1708,Girl's 1st Birthday Felt Novelty Headband
1709,The Dead of Night
1710,Firenze
1711,"Funko Pop Animation: Pusheen - Pusheen Mermaid Collectible Figure, Multicolor"
1712,EuroGraphics Volkswagen Groovy Bus Collage Puzzle (2000 Piece)
1713,"Elenco Teach Tech “Air Screamer”, Compressed Air Powered Racing Vehicle, STEM Building Sets for Kids 10+"
1714,Thanksgiving Make Your Own Headband Kit | Makes Up To 4 Headbands | Party Activity
1715,Melissa & Doug Jigsaw Puzzles Set - Bugs and Dinosaurs (60 pcs)
1716,"German fighter ""Messerschmitt"" Bf-109F4"
1717,Banana Panda - Let’s Play Animal Bingo - Classic Kids Game for Ages 2 Years and Up
1718,Funko Pop! Games: Overwatch Action Figure - Widowmaker
1719,BANZAI Splish Splash Water Park
1720,Rubie's Tennyson Ben10Ben Boys Costume
1721,Hello Kitty Toy Wagon
1722,"Glitter Girls Dolls by Battat - Candice 14"" Poseable Fashion Doll - Dolls for Girls Age 3 & Up"
1723,"Branch Classic Trolls Costume, Multicolor, Small (4-6)"
1724,Little Foot TPT That Purple Thang-
1725,Chara-ani Fate/Apocrypha: Red Faction Lancer of Red Toy'sworks Collection Niitengo Premium Figure
1726,Kangaroo Trading Bison with Latte Kids Recliner
1727,Haunted House Children's Costumes Pirate Boy - Child's Large
1728,Rhode island novelty - Inflatable Dragon
1729,"Amscan AMI 37014.18 Party Supplies, 2.5 oz, Silver"
1730,Hazelnut Chipmunk Family
1731,"Swimline Lycra Floating Swim Trainer, Boys"
1732,Hot Wheels Indy Car Shell & Wheels
1733,"Beistle 50804-P Metallic Wrapped Balloon Weights, Set of 12."
1734,"Big Joe , Lavender Polka Dot Classic Bean Bag Chair, Lavendar with White"
1735,Dinotrux Bundle [Amazon Exclusive]
1736,Melissa & Doug Personalized Vehicles Wooden Peg Puzzle with Sound Effects (8 Piece)
1737,"The Kids Room By Stupell See You Later Alligator Animal Goodbyes Stretched Canvas Wall Art, 10 x 1.5 x 24, Proudly Made in USA"
1738,"Wildkin Duvet Cover, Full, Dinosaur Land"
1739,"SunWorks Construction Paper, Sky Blue, 12"" x 18"", 100 Sheets"
1740,SUPERSOAKER Super Soaker Hydra
1741,"Squish-Dee-Lish 5 Pack Slow-Rise Squishies, Series 3 - Pink Sea Shell, Blue Whale, Owl, Piñata, Blue Duck Bendable-Toy-Figures"
1742,Great Eastern Entertainment Bleach Kisuke Hat
1743,Folkmanis Raven Hand Puppet
1744,"Jay Franco Episode 7 BB8 Medallion Decal Woven Jersey Sweatshirt Fleece Blanket Twin, 60"" x 90"", Star Wars EP7"
1745,Star Wars Shoretrooper Classic Mini Bust
1746,Shopkins Strawberry Kiss Lil' Characters Shades Instant Costumme Sunglasses
1747,"Baby Doll Bedding Toddler Sheet, Red"
1748,"Badger Basket Bamboo Beach Sandbox with Liner & Cover Sandbox with Cover & Liner, Natural/Green"
1749,Dragonball Z Frieza Fools Snaback Hat Cool Anime Hat
1750,Bright Starts Lots of Links Accessory and Baby Einstein Take Along Tunes Musical Toy
1751,BathBlocks Bathtime Consruction Building Toy - Coast Guard Boat & Helicopter
1752,"Tomy Stink Bomz Plush Toy, Ripper"
1753,Official Nerf Zombie Strike 12-Dart Refill Pack
1754,"Didax Educational Resources Number Sleuth, Grades 6-8"
1755,"Thumbsup UK, Dog Mask, Costume, MRDOG"
1756,Licenses Products Social Distortion Logo Magnet
1757,Renegade Pirate Child Costume
1758,Basic Fun Carmen Sandiego Handheld Electronic Game
1759,"Kids Tech Robots, Lights Up, Battles Opposite Robot, Easy to Control & Small Enough to Carry, Suitable for Ages 6+, Remote Controlled Robots, Great Gift Idea"
1760,Classic Wood Chess Set
1761,Disney Elena of Avalor Deluxe Ball Gown Girls' Costume
1762,"Funko Galactic Plush: Rick & Morty - Birdperson Collectible Figure, Multicolor"
1763,"MerryMakers Henry & Leo the Lion Plush Doll, 15-Inch"
1764,PJ Masks Catboy Medium Plush Basket
1765,"Melissa & Doug Sunny Patch Giddy Buggy Bug House Toy with Carrying Handle and Easy-Access Door, Great Gift for Girls and Boys - Best for 3, 4, 5, and 6 Year Olds"
1766,PLAYMOBIL Ghostbusters Firehouse
1767,"The Puppet Company Snake Finger Children Toys Puppets,"
1768,"Swing Set Stuff Children's Steering Wheel with SSS Logo Sticker, Blue"
1769,Ravensburger Mama Knows Best 1000 Piece Jigsaw Puzzle
1770,Funko Pop! Directors: Ava DuVernay
1771,"Anna Classic Costume, Small (4-6x)"
1772,SCHLEICH Monster Octopus w/ Weapon
1773,Crocodile Creek Eco Kids Reusable Jungle Jamboree Lime Green Sandwich Keeper Eco Kids Sandwich Keeper
1774,"Hedstrom Marvel Spider-Man 36"" Bop Bag, Multicolor"
1775,"Hape E3461 Wooden Doll House Furniture Playground Set And Accessories Doll House Accessories,"
1776,Pokemon TCG: Poke Ball Tin Red - 3 Booster Pack with 1 Coin
1777,"amscan WWEParty Container, Party Favor"
1778,"Minnie Happy Helpers Sparkle N' Clean Vacuum, Pink"
1779,Basic Fun Fisher-Price Play Tape Recorder
1780,MasterPieces Time Away Sunset Ritual - Lake & Mountains 1000 Piece Jigsaw Puzzle by Dominic Davidson
1781,Eureka Peanuts Summer Fun Paper Cut Outs
1782,"Losi 8IGHT Screw/Nut Assortment Box, LOSA6140"
1783,"Buffalo Games - Vivid Collection - Leopard Jungle - 1000 Piece Jigsaw Puzzle, Multicolor"
1784,"Pokemon 2 Inch Battle Action Figure 2-Pack, includes 2"" Rowlet and 2"" Litten"
1785,CHROMA 000914 914 Hello Kitty Plush Auto Ornament
1786,Pacific Rim: Extinction - Starter Set
1787,Ingenio Magic Opposites Flash Cards
1788,Swing Set Stuff Climbing Rope with Steps (Blue) & SSS Logo Sticker
1789,"Clank!, Base"
1790,Franklin Sports 6 Hole PVC Bean Bag Toss Game
1791,Creative Playthings Chin Up Bar
1792,American Greetings Finding Dory Party Treat Bags (8 Count)
1793,Cardline Globetrotter
1794,"Ontel Magic Tracks The Amazing Racetrack That Can Bend, Flex and Glow - As Seen On TV"
1795,"Sweet Jojo Designs Blush Pink, Grey and White Watercolor Elephant Safari Girl Twin Kid Childrens Bedding Comforter Set - 4 Pieces"
1796,Board Games and Beer T Shirt For Gamer and Drinker
1797,Deluxe 1.75-in Thick Cool Pool Float - Aqua
1798,Bear Valley Board Game
1799,Crazy Bonez Gothic Lantern
1800,Ben 10 Armored Heatblast Figure
1801,"Melissa & Doug Created by Me! Pink Wooden Flower Jewelry Box Craft Kit - The Original (Great Gift for Girls and Boys – Best for 4, 5, 6, 7 and 8 Year Olds)"
1802,Legendary A Marvel Deck Building Deadpool Expansion Board Game
1803,Carson Dellosa Funky Frogs Shape Stickers (168122)
1804,Markwort Lite Weight and Weighted Leather Baseball
1805,Who’s That Girl 21-Piece Dress up Trunk [Amazon Exclusive]
1806,WWE Randy Orton Elite Collection Action Figure
1807,K2 Skate Men's MOD 110 Inline Skate
1808,Vallejo Game Air Sombre Grey Paint
1809,"Redcat Racing 88049-BL Pickup Truck Body (1/10 Scale), Black/Blue"
1810,"Crayola Glitter Glue Bulk, 20 Count Classpack, Washable Craft Glue, 5 Assorted Colors"
1811,"TOMY John Deere Big Scoop Tractor Toy, 21-Inch"
1812,"LANG - 500 Piece Puzzle -""Magical Evening"", Artwork by Laura Berry - Linen Finish - 24” x 18” Completed"
1813,Disney Sofia The First Mermaid Magic Princess Sofia Doll
1814,"PJ Masks PJ Seeker with Bonus Catboy, Owlette and Gekko Figures - Amazon Exclusive Mailer"
1815,"Team Associated 1658 Factory Team Hex Driver Bit, 1/16"""
1816,"Hygloss Products Blank Community Puzzle - Create-A-Size - Fun Group Activity - Great for Parties, Weddings, Classroom, Office & More - 84” x 44” - 200 Center Pieces - 200 Guests"
1817,Creative Converting Congrats Grad Accordion Glitter Centerpiece
1818,Little Tikes Bubble Lawn Mower
1819,"Amscan Party Perfect Round Latex Balloons Decoration, 4 Pieces, Made from Latex, Yellow Sunshine, 24"" by"
1820,"Dynamite Gold Bullet Connector Set, 6.5mm (10), DYNC0092"
1821,Jada Toys Hello Kitty Jet Plane Play Set
1822,"Funko Pop! Marvel: Max Venom - Groot 10"""
1823,"Aurora World 8"" Sting Ray Toy"
1824,"Stephen Joseph Floor Puzzle, USA"
1825,"Learning Resources New Sprouts Complete Play Food Set, 50 Pieces"
1826,"Funko Plush: Cuphead - King Dice Collectible Figure, Multicolor"
1827,"Eureka Dr. Seuss Thing 1 Paper Cut Outs for Schools and Classrooms, 36 pieces, 5.5"" W x 5.5"" H"
1828,Ceaco Perfect Piece Count Puzzle - Thomas Kinkade Disney Dreams Collection - Beauty and the Beast
1829,Forum Novelties Princess Party Sash
1830,K2 Skate Alexis 84 Boa Inline Skate
1831,"Great Eastern Entertainment The Seven Deadly Sins - Hawk Collectible Plush Toy, 5"""
1832,LEGO The Powerpuff Girls Mojo Jojo Strikes 41288 Building Kit (228 Pieces)
1833,Adventure Planet Plush - MAKO Shark ( 20 inch )
1834,"Sunny toys 38"" Large White Unicorn Marionette"
1835,PLAYMOBIL How to Train Your Dragon III Astrid & Hiccup
1836,Sax True Flow Water Soluble Block Printing Ink - 8 Ounce Jar - White
1837,Brainstring Retro Brainteaser Puzzle
1838,"RPM Lower Spring Cups for HPI Savage, Savage-X, E-Savage and Most Losi & Traxxas Shocks, Black"
1839,"Gorilla Playsets 01-0004-TS-2 Frontier Wooden Swing Set with Sunbrella Canvas Canopy, Timber Shield Posts, Slide and Tire Swing"
1840,Popular Playthings Mix or Match Vehicles 2 Kit
1841,"HearthSong Animal Jump-Along - Green Triceratops - 23"" L X 8"" W X 16"" H"
1842,Square Enix Dragon Quest XI: Sylvando & RAB Action Figure Set
1843,PlayMonster Wonder Crew Adventure Pack - Firefighter Toy
1844,GreenPro 61 Key Portable Electronic Piano Keyboard LED Display with Adjustable Stand and Music Notes Holder
1845,"Lush Décor Race Cars 2 Piece Reversible Quilt Kids Bedding Set, Twin, Blue/Orange"
1846,The New York Doll Collection Dolls Jogging Stroller - Pink Hearts Designed Jogging Stroller for Dolls
1847,Hey! Play! 80-HJD931204 Wooden Musical Toy
1848,Rubie's Costume Co - Marvel Avengers Infinity War Child Hulkbuster Gloves
1849,Far Out Toys Pulp Heroes Snap Bots Star Wars 2-Pack (Boba Fett + Chewbacca)
1850,Vallejo Game Air Plate Mail Metal Surface Primer Paint
1851,Kotobukiya Touken Ranbu-Online- Shokudaikiri Mitsutada Figure
1852,"Mech-X4 5"" Robot & Battle Submarine Dual Pack"
1853,Bachmann Trains Thomas And Friends - Thomas The Tank Engine With Moving Eyes
1854,"Mudpuppy Unicorn Magic to Go Puzzle, 36 Pieces, Ages 3+, Travel-Friendly Bag, Made with Safe, Non-Toxic Materials"
1855,Forum Novelties Child's Disco Costume Jumpsuit
1856,"NewPath Learning 10 Piece Science Genetics and Heredity Curriculum Mastery Flip Chart Set, Grade 6-10"
1857,"Plum Azur Lane: Ijn Yamashiro 1: 7 Scale PVC Figure, Multicolor"
1858,Battat – Light & Sound School Bus – School Bus Toy Vehicle for Toddlers 18 Months + (6Pc)
1859,Shrinky Dinks Shrinky Dinks DIY Keepsakes Project Pack Kids Art and Craft Activity
1860,Edushape Mini Golf Garden Party Game
1861,Green Toys Fire Engine
1862,Pop A Zit Game
1863,Daron Skymarks Etihad 787-9 Airplane Model (1/200 Scale)
1864,"hand2mind STEM in Action, Coding Robot Mouse Classroom Set, Learning Activities Exploring Basic Needs of Animal As Students Code & Program, Life Science Lesson, STEM.org Authenticated"
1865,HANSA Burrowing Owl Plush
1866,"Whitmor Kids Canvas Collapsible Cube-10 x 10 x 10 inches, Pink, Owl Collection"
1867,WWE Wrestlemania Elite Kevin Owens Figure
1868,Enchantimals Huggable Cuties Felicity Fox Doll & Flick Figure
1869,"Zvezda 7027 - Airliner Boeing 737-700/C-40B - Plastic Model Kit Scale 1/144 109 Parts Lenght 9"""
1870,"Amscan Party Supplies Sparkling Celebration 30th Birthday 9"" Round Prismatic Plates - 8 count"
1871,Folkmanis Polar Bear Cub Hand Puppet
1872,Power Trains Car Pack: Space
1873,"Pacific Play Tents Tri-Color Dome Tent and Tunnel, 2 Piece Bundle, 48” x 48” x 42” Tent and 6 Foot Tunnel"
1874,Great Eastern Entertainment Sonic The Hedgehog Sonic & Amy Hinge Wallet
1875,"Precious Moments Dolls by The Doll Maker, Linda Rick, A Small Child Shall Lead Them, 12 inch Doll"
1876,Quest Scooby Doo Trap Time Deluxe Mystery Machine
1877,Scalextric Jaguar E Type Union Jack 1:32 Slot Race Car C3878
1878,HydroTools by Swimline Clear Weighted Triangle Pool Vacuum Head
1879,"Lamaze Disney Lion King Clip & Go, Simba Baby Toy"
1880,Rubie's DC Superheroes Tutu Skirt
1881,"Rubik's Cage Game, Head-to-Head Brain Teaser Strategy Game Based On The Rubik’S Cube for Ages 7 & Up"
1882,FanWraps Fallout 4 Vault-Tec Weathered Tin Tote Replica
1883,"Rubie's Costume Co Women's Teenage Mutant Ninja Turtles Classic Michelangelo Eye Mask, Orange, One Size"
1884,Daron Worldwide Trading Postage Stamp USN E-2C Hawkeye 1/145 Vaw-116 Sun K Airplane Model
1885,"Aurora World 18"" Princess Sparkles - Angela, Multicolor"
1886,Hape Polym Construction Site | 43Piece Building Brick Forklift Bulldozer Toy Set with Figurines & Accessories
1887,Whitmor Frog Collapsible Cube
1888,Smugglers Family Board Game
1889,Late for the Sky Boston-opoly
1890,Trend Enterprises Trend School Days Sparkle Sticker Variety Pack - Set of 648 - Assorted Colors - T63909
1891,"Fisher-Price Nickelodeon Shimmer & Shine, Teenie Genies Multi-Pack, Season 3 #5"
1892,"Fisher-Price Thomas & Friends Wooden Railway, Deluxe Over-The-Track Signal - Battery Operated"
1893,Wonder Crew Superhero Buddy - Marco
1894,Uncanny Brands Star Wars Darth Vader Elite 2-Slice Toaster- Star Wars Icon Logo onto Your Toast
1895,Trend Lab Unicorn Moon Jumbo Deluxe Flannel Swaddle Blanket
1896,"Snuggie Tails Allstar Innovations Mermaid Blanket for Kids (Pink), As Seen on TV"
1897,Power Trains Military Helicopters Engine Pack
1898,"Play-Doh E2930 Buzz 'n Cut Fuzzy Pumper Barber Shop Toy with Electric Buzzer and 5 Non-Toxic Colors, 2-Ounce Cans"
1899,"GUND Jolly Santa Stuffed Plush, 7"""
1900,Revell SnapTite 2017 Ford F-150 Raptor Pick Up Truck Model Kit
1901,"MasterPieces Cruisin' Route 66 Jigsaw Puzzle, Phil's Diner, Featuring Art by Bruce Kaiser, 1000 Pieces"
1902,AMAV Sweet Tarts Ice Pops Maker Toy - DIY Make Real Popsicles - Best Activity for Friends to Do Together - Perfect Present for Kids Aged 4+
1903,"LEGO City Garage Center 60232 Building Kit, New 2019 (234 Pieces)"
1904,"Fisher-Price Little People Noah's Ark, Frustration Free Packaging"
1905,"Union Creative Hyperdimension Neptunia: Black Heart (Dress Version) PVC Figure, Multicolor"
1906,"Disney Monster's Inc. Mike Wazowski Round Decorative Pillow, Green/Green/Blue/White"
1907,"Crayola Washable Palm Grasp Crayons, Amazon Exclusive, 9ct, Toddler Toys, Gift"
1908,Breyer Freedom Series (Classics) Racing The Wind | Horse and Foal Toy Set | 1:12 Scale | Model #62208
1909,"Colorflame Birthday Candles With Colored Flames - Birthday, Party, Cake Decor - 12 Candles Per Box"
1910,Spot It! (Color/Packaging May Vary)
1911,"MasterPieces Inspirational Jigsaw Puzzle, The Last Supper Panorama, Featuring Art by William T. Ternay, 1000 Pieces"
1912,VTech Scoop & Play Digger
1913,Snow Time
1914,Automoblox T900 Rescue Truck
1915,"HearthSong Children's Potholder Hook and Loop Kit - Includes 115 Non Fading Cotton Loops, Loom, and Weaving Hook - Multi-Colored - DIY Arts and Crafts for Kids - 7.5'' Sq"
1916,Playcraft Woodbridge Shuffleboard Table
1917,"Poolmaster Los Angeles Lakers NBA Swimming Pool Float, Giant Mattress"
1918,"TCG Toys 20Q Sport, Gold/Silver"
1919,Coloring Books Ella Drawing Book
1920,"LEGO Star Wars Resistance Y-Wing Microfighter 75263 Cool Toy Building Kit for Kids, New 2020 (86 Pieces)"
1921,Balloon Fisher King 400 Multi-Clip Pro Pack
1922,"E-flite Landing Gear Set with Float Wire Screws: UMX Timber, EFLU3954"
1923,"Forum Novelties 80044 Princess Kit-Like 79515, Standard, One Size, Pink"
1924,"Stephen Joseph Wallet, Woodland"
1925,Disney Frozen 2 Oversized Coloring Book with Paint Palette and Paintbrush 45815
1926,"Cuddle Me Luxury Plush, Fox, Brown"
1927,Minecraft Comic Maker Wolf Action Figure
1928,Bigjigs Rail Wooden Five Way Engine Shed - Other Major Rail Brands are Compatible
1929,Blue Orange Games Vroom Vroom Award Winning Wooden Skill Building STEM Counting Game for Kids
1930,"LeapFrog Dino's Delightful Day Alphabet Book, Green"
1931,Stages Learning Materials Language Builder Sequencing Flash Cards Photo Action and Self-Help Skills Sequence Cards for Autism Education and ABA Therapy
1932,Rhode Island Novelty Plastic Firefighter Chief Hat (Set of 24)
1933,Hot Wheels 9-Car Gift Pack (Styles May Vary) AND Hot Wheels Super Speed Blastway Track Set [Amazon Exclusive]
1934,"Swing-N-Slide PB 8331 Playful Palace Swing Set with Slide, Swings, Wood Roof, Picnic Table & Climbing Wall, Wood"
1935,"Hornit Mini Lids Multi-Sport Helmet with Rear Light | CPSC Certified for Biking, Skateboarding, and Skating | Fully Adjustable for Comfort and Safety"
1936,"Axial SCX10 II UMG10 4WD RC Rock Crawler Electric Unassembled Off-Road Kit (Radio System, Battery, Charger, Electronics Sold Separately): 1/10 Scale, AXI90075"
1937,DIAMOND SELECT TOYS Marvel Gallery Black Panther Movie Killmonger PVC Diorama
1938,"Rohl U.3270L-PN-2 Mb1951Lmtcb Two 1/2"" Deck Sidevalves"
1939,Schylling Silver Racecar Metal Speedster
1940,"American Educational Glass Right Angle Prism, 50mm Length, 32mm Width (Bundle of 5)"
1941,"PRANG Refill Pans for Oval Watercolor Paint Set, 12 Pans per Box, Turquoise Blue (00819)"
1942,"Jada Venia 9.75""x7.75"" Sherri Ohler Sleigh Light Box Insert"
1943,"Nella The Knight Classic Child Girl Costume, M (3T-4T)"
1944,Hot Racing YEX1201 Aluminum Front Bulkhead Gearbox - Yeti XL
1945,"Funko Star Wars Smuggler's Bounty Box, Cloud City Theme"
1946,"Forum Novelties I'm Invisible Costume Stretch Body Suit, Pink, Child Large"
1947,"Pillow Pets Signature, Friendly Frog, 18"" Stuffed Animal Plush Toy"
1948,Trends International Trolls Poppy Wiggle Pens
1949,SET Junior Board Game
1950,Traxxas Alias Led Light Bar
1951,"NPW Twisted Games, Akward Silence"
1952,Black Catsuit - Adult M/L | 2 Ct.
1953,TIME Stories: Lumen Fidei
1954,"Educational Insights Design & Drill See-Through Creative Workshop - Drill Toy, STEM & Construction, Building Toy"
1955,"Redcat Racing Monster Truck Body, Silver/Black/Red"
1956,"UST Learn & Live Educational Card Set with Durable, Waterproof, Compact Design and Essential Outdoor Skills for Hiking, Camping and Outdoor Survival"
1957,RPM 70362 Rear Shock Tower Slash/Stampede 4x4 Black
1958,"Mi-Zone Kids Dinosaur Dreams Twin Kids Bedding Sets for Boys - Grey, Blue, Dinosaur – 3 Pieces Boy Comforter Set – Ultra Soft Microfiber Kid Childrens Bedroom Comforters"
1959,"Little JJ Cole Backpack for Kids, Robot"
1960,"Walthers Cornerstone HO Scale Model United Petroleum Refining Kit, 13-1/2 x 8-1/4 x 15 34.3 x 21 x 38.1cm"
1961,Lauri Lacing & Tracing - Noah's Ark Set
1962,Star Wars Boys' Storm Trooper Winter Beanie & Glove Set
1963,"BePuzzled Original 3D Crystal Jigsaw Puzzle - Fruit Grapes Assembly Brain Teaser, Fun Model Toy Food Gift Decoration for Adults & Kids Age 12 and Up, 41 Pieces (Level 2)"
1964,"hand2mind Learn to Read with Bob Books and VersaTiles - Sight Words Set (Ages 3-6) | Sight Words Games, 10 BOB Books, 20-Page Workbook & 1 Answer Book, Award Winning"
1965,Iridescent Lets Party Headbands - 5 Pack
1966,Mech-X4 Mech-Link Communicators Role Play Set
1967,"Funko 35991 POP PEZ: Batman 1966 TV - Robin, Multicolor"
1968,"HHIP 4902-0045 Hastings Triplet Magnifier, 10 x Power, 21 mm Lens Diameter"
1969,"Perler Beads Creative Kid Bead Kit Kids Craft, 5000 pcs"
1970,Star Wars Rebels - Ezra Lightsaber
1971,Wheels on The Bus Matching Game
1972,"34"" Foil Gold Number 1 Balloon"
1973,Funko Pop! Disney: Aladdin Live Action - Prince Ali
1974,"Candylocks, 3-Pack, Posie Peach 3-inch Scented Collectible Surprise Doll and 2 Pets with Accessories"
1975,"World of Eric Carle, The Very Hungry Caterpillar Happy Birthday Oversized Soft Book, 8.5"""
1976,Ceaco Strawberry Shortcake On Her Vespa Puzzle (60Piece)
1977,"Hathaway Ranger 5' AIR Hockey Table, 60"" L x 30"" W x 31"" H, Black"
1978,Square Enix Final Fantasy: Chocobo Autograph (Black Version) Plush
1979,Darice St. Patrick's Day Pot O' Gold Foam Stickers-67 pc
1980,"School Smart Money Kit, Bills and Coins with 12 Compartment Plastic Tray, Grades K-4"
1981,Disney Pixar Cars Wheel Action Drivers Race & Win Playset
1982,"FDP SoftScape Super Climb and Slide Climber for Toddlers and Kids, Colorful Beginner Soft Structure for Active Playtime (6-Piece Set) - Contemporary"
1983,The Color Monster Childrens Game
1984,"The Tin Box Company 181007-12 Crayola 2-Piece Storage Tin with Sharpener, Crayons Not Included"
1985,EuroGraphics Nasa Solar System 1000 Piece Puzzle
1986,Star Wars: The Last Jedi First Order Stormtrooper Electronic Mask
1987,"Eureka Dr. Seuss Oh the Places You'll Go Motivational Poster Classroom Door Decoration, 12'' x 45''"
1988,"Shopkins, 5 Wood Puzzles Set"
1989,"DC Collectibles Yellow Lantern Power Battery & Ring Prop Replica, 1: Scale"
1990,"The Kids Room by Stupell Smile Make Memories Rainbow Rectangle Wall Plaque, 11 x 0.5 x 15, Proudly Made in USA"
1991,Yocaher New VW Vibe Beach Series Longboard Complete Cruiser and Decks Available for All Shapes (Complete-Oldschool-Blue)
1992,"Arcane Tinman Dragon Shield Shell: Deck Box Collectible Card, Black, One Size"
1993,Buffalo Games - Chuck Pinson - Brookside Retreat - 1000 Piece Jigsaw Puzzle
1994,"Ceaco Tim Rogerson Disney Mickey Mania Hugs & Kisses Jigsaw Puzzle, 550 Pieces"
1995,"Cathedral Art Saint Michael Pocket Token, 1-Inch"
1996,Daron Delta Air Lines Radio Control Plane with Lights & Sound
1997,"Wild Republic Llama Pegacorn Plush, Stuffed Animal, Plush Toy, Gifts for Kids, 12"""
1998,"Luigi Skirt Version Costume, Small (4-6x)"
1999,"Amscan 450458 Party Supplies Chalkboard Paper Stickers, 3 1/4"" x 2 1/4"", Multicolor"
2000,Watchover Voodoo Mr Franken Voodoo Novelty
2001,Swimline Cornhole Game
2002,DE Racing 110LT Mud Guards for Losi 8ight-T 2.0
2003,Charades Women's Suicide Squad Harley Quinn Costume
2004,Funko POP Movies: Harry Potter Action Figure - Luna Lovegood
2005,"GUND Pusheen Pusheenicorn Unicorn Cat Sound Plush Stuffed Animal, Purple, 7.5"""
2006,"Amscan Girls Miss Meow Cat Costume - Toddler (3-4), Multicolor"
2007,Transylvanian Vampire Toddler Costume
2008,"Kindi Kids Snack Time Friends, Pre-School 10 inch Doll"
2009,"Spider-Man Nerf Power Moves Marvel Web Blast Web Shooter Nerf Dart-Launching Toy for Kids Roleplay, Toys for Kids Ages 5 & Up"
2010,"Wildkin Kids Insulated Lunch Box for Boys and Girls, Perfect Size for Packing Hot or Cold Snacks for School and Travel, Patterns Coordinate with Our Backpacks and Duffel Bags, Wild Animals"
2011,"Air Zone 20"" Rhino BMX Freestyle Bike"
2012,"Crayola Kids Wooden Easel, Dry Erase Board & Chalkboard, Amazon Exclusive, Kids Toys, Gift, Age 4, 5, 6, 7"
2013,Super Wings - Donnie's Driller Vehicle | Transform-A-Bot Donnie Toy Figure
2014,Spektrum Remote Receiver Extension 9-inch
2015,"UPD Disney 10800M Large Beanbag Plush with Hangtag in PDQ, 9-10.5"", Multicolor"
2016,Glitter Glasses | Disney Ariel Dream Big Collection | Party Accessory
2017,Bento Box Style 2 Layer Lunchbox by Asvel
2018,Corolle Mon Doudou Babibear 2-in-1 Musical Baby Doll & Nightlight
2019,"Hampton Nautical USS Constitution Ship in a Glass Bottle, 5"""
2020,Lord of the Rings LCG: The Drowned Ruins
2021,"Mi Zone Kids Choo Choo Charlie Twin Kids Bedding Sets for Boys - Blue, Parchwork Trains, Plane, Plaid – 6 Pieces Boy Comforter Set – Ultra Soft Microfiber Kid Childrens Bedroom Comforters"
2022,"Tommy Bahama Pineapple Pinstripe Sheet Set, King, Yellow"
2023,Tropical Fun Party Maracas (2/Pkg)
2024,Little Cook's Work Station Kitchen
2025,"ECR4Kids ELR-12401 Assorted Colors Sand and Water Adjustable Activity Play Table Center with Lids, Square (2-Station)"
2026,"Edushape Bead & Bell Baby Shakers Set, 3 Piece, Assorted Colors"
2027,"Kate Aspen Set of 4 Assorted Candle, Whooo's The Cutest Baby Owl"
2028,"Itzy Ritzy Teething Ball & Training Toothbrush – Silicone, BPA-Free Bitzy Biter Lemon-Shaped Teething Ball Featuring Multiple Textures to Soothe Gums and an Easy-to-Hold Design, Lemon"
2029,"LEGO City Jungle Explorers 6174645 Air Drop Helicopter, Multi"
2030,"Stephen Joseph Sparkle Goggles, Purple"
2031,Foxmind Architecto
2032,Steve Jackson Games Munchkin Pathfinder: Truly Gobnoxious Card Game (6 Player)
2033,"The Quest Super Cruiser Purple Artisan Bamboo and Maple 44"" Longboard Skateboard"
2034,Ben 10 Hot Shot Action Figure
2035,"LEGO Lunch Box, Medium Pink"
2036,"Rubie's Costume Boys Justice League Deluxe Flash Costume, Large, Multicolor"
2037,"MightySkins Skin Compatible with Razor A Kick Scooter - Geo Tile | Protective, Durable, and Unique Vinyl Decal wrap Cover | Easy to Apply, Remove, and Change Styles | Made in The USA"
2038,"Gold Medal Bean Bags XX-Large Denim Bean Bag with Pocket, Camoflouge"
2039,Steiff Blue Whale Mama
2040,WALIKI Bouncy Horse | Inflatable Hopping Animal | Toddler Riding Horse | Hoppy Horse Hopper | Green
2041,Alex Little Hands Ready Set Write and Wipe! ABC and 123 Kids Toddler Art and Craft Activity
2042,Confetti | Ocean Buddies | Birthday
2043,ThinkFun Clue Master Logic Game and STEM Toy - Teaches Critical Thinking Skills Through Fun Gameplay
2044,"Unique How to Train Your Dragon Party Balloons, 8 Ct."
2045,DC Super Hero Girls: Supergirl Mini Plush Dolls
2046,"Ravensburger Pet Park - 300 Piece Jigsaw Puzzle for Kids – Every Piece is Unique, Pieces Fit Together Perfectly"
2047,"Westcott Titanium Bonded Razor Paper Cutter, Assorted, 14927"
2048,Level 99 Games Exceed Red Horizon Eva & Kaden vs Lily & Miska Board Game
2049,Forum Novelties Men's Adult Velvet Fedora Hat with Leopard Print Band
2050,Jay Franco Harry Potter Spellbound 3 Piece Twin Sheet Set
2051,Redcat Racing Complete Rear Wheels (2 Piece)
2052,What's In the Box
2053,Whitmor Kids Canvas Collapsible Cube Fox
2054,"Aurora World 11"" Endearing Teddy - Md"
2055,"Super Finger Flashlights with 3 LED Lights and Fiber Optic Attachments, Set of 8"
2056,Inflatable Pin the Tail on the Donkey Game | Game Collection | Party Accessory
2057,Friends Top 30 Moments Top Trumps Card Game
2058,Disney Star Wars Rey Deluxe Dress Up Set
