2419,"The Tin Box Company Batman Bobble Head Bank, Black"
2420,SCHLEICH 15012 Dimorphodon
2421,DC Comics Multiverse DC Rebirth the Ray Figure
2422,"Rubie's Avatar Neytiri Child's Costume, Medium"
2423,Playskool Heroes Transformers Rescue Bots Knight Watch Optimus Prime
2424,"Ravensburger Labyrinth Family Board Game for Kids & Adults Age 7 & Up - Millions Sold, Easy to Learn & Play with Great Replay Value"
2425,"Linzy Plush 96757 10"" Soft Dreams Owl with Lullaby & Night Light, 10"", Cream"
2426,"B. toys by Battat Mini Pull-Back Vehicles Set, Bus & Cars"
2427,Ticket to Ride: Nordic Countries
2428,Calico Critters Comfy Living Room Set
2429,Jay Franco Disney Mickey Mouse Sketch Queen Sheet Set
2430,Dachshund-opoly
2431,MightySkins Skin Compatible with DJI Phantom 3 Standard Quadcopter Drone wrap Cover Sticker Skins Solid Gray
2432,Melissa & Doug On-the-Go Water Wow! - Bible Stories and Connect the Dots Bundle
2433,B & R Plastics 1016R E-Z Foldz Red Step Stool
2434,"Leprechaun Loot Includes: 12 - Green Party Beads, 25 - Gold (Plastic Coins) Party Accessory (1 count) (37/Pkg)"
2435,Magnetic Marbles
2436,Ravensburger Eiffel Tower 216 Piece 3D Jigsaw Puzzle for Kids and Adults - Easy Click Technology Means Pieces Fit Together Perfectly
2437,Funko Hero Plushies Marvel: Avengers Infinity War - Groot
2438,"Rhode Island Novelty 1 Bubbles, 72, White"
2439,Dowling Magnets Magnet Math Magnetic Demonstration Place Value Sticks
2440,"Llorens 11"" Soft Body Crying Baby Doll Emma"
2441,The Puppet Company Large Birds Love Bird Hand Puppet
2442,"AngelStar 15513 Archangel Pocket Shield Token, 1-1/4 by 1-Inch, Michael"
2443,Bachmann Industries B&O #74 Diesel Locomotive Train
2444,"Dimensions 73-91728, Bald Eagle, PaintWorks Paint by Numbers Kit for Adults and Kids, 20'' x 14'"
2445,Creativity for Kids Big Gem Diamond Painting Kit - Create Your Own Woodland Forest Friends Diamond Art Stickers and Suncatchers - Diamond Art for Kids
2446,Corolle Les Cheries Coat and Bag Fashion Set
2447,"Amscan 398629 Fun-Filled, LOL Jump Rope, Supplies, Multicolor, 80"" Party Favors, One Size"
2448,"green sprouts Sprout Ware Dumbbell Rattle made from Plants | Encourages whole learning the healthy & natural way | Plant based, Easy to hold & shake, Playful rattle sound"
2449,Peppa Pig 4-Figure Carry Case Storage
2450,"Delta Children Kids Table & Chair Set with Storage (2 Chairs Included), Grey/Blue"
2451,"Darice BB0049S, 12 Piece, Ty Beanie Boos Sticker Set, Girly Wiggle Eyes"
2452,"SugarSugar Dance Craze Leg Warmers, Turquoise, One Size"
2453,Black + Decker Jr. Carpenter Dress-up & Play Set (Amazon Exclusive)
2454,Funko Dorbz: The Flash - Zoom Action Figure
2455,DIAMOND SELECT TOYS Marvel Gallery: Avengers Endgame: War Machine PVC Figure
2456,Childrens Christmas Bunny Jumper
2457,"Little Buddy USA Animal Crossing New Leaf Smiling Isabelle/Shizue 8"" Plush"
2458,Hobby Wing 38010204 Ezrun Max10 ESC with 3652SL G2 Sensorless Brushless Motor - Combo (4000Kv)
2459,Factory Entertainment Mortal Kombat Scorpion Bottle Opener
2460,"Papo Grey Mouse Figure, Multicolor"
2461,"Razor PowerWing DLX Replacement Rear Wheels, Green"
2462,"Fisher-Price Burger Set, Multicolor 93500"
2463,ALEX DIY Knot-A Shark Kit Playset
2464,My Little Pony Friendship is Magic Starlight Glimmer Small Plush
2465,"amscan Disney/Pixar Incredibles 2"" Scene Setter with Props, Party Favor, One Size, Multicolor"
2466,EverEarth Eco City Train Set EE33591
2467,Rubie's Men's Nightmare On Elm St Freddy Krueger Shirt with Mask
2468,Harry Potter Hogwarts Battle Cooperative Deck Building Card Game | Official Harry Potter Licensed Merchandise | Harry Potter Board Game | Great Gift for Harry Potter Fans | Harry Potter Movie artwork
2469,Disney Frozen Anna Small Doll with Removable Cape Inspired by Frozen 2
2470,Mudpuppy Space Race Travel Game
2471,Hot Wheels Star Wars Toy Vehicles
2472,"Fisher-Price Little People Disney Princess, Snow White & Dopey Figures"
2473,Ginger Ray Gold Foil Flower Party Backdrop - 2 Metre - Pick & Mix
2474,"Stupell Industries Flower Plants Woman Figure Model Modern Painting Wall Plaque, 10 x 15, Multi-Color"
2475,Perfect Petzzz Chocolate Lab Plush
2476,"Constructive Playthings Wooden Puppet Stand, Display Holds 8 Puppets"
2477,Ginger Ray OB-115 Gender Reveal
2478,"Vallejo Acrylic Paint, IJA-Kare-Kusa-IRO Parched Grass (late)"
2479,DohVinci 6-Pack Drawing Compound - Mixed Colors
2480,"Baby Einstein Storytime with Lily Plush Puppet Toy & Book, Ages 6 months and up"
2481,Rubie's Indiana Jones Light Up Crystal Skull
2482,Mastermind for Kids -- Codebreaking Game Plays on Three Levels
2483,SwimWays Aquaria Avena Lounge
2484,Space 1889 Mars Sourcebook Space 1889 Supp. Hardback
2485,"Nino Percussion NINO556 Wood Stirring Drum With Handle & Beater, Natural Finish"
2486,"hand2mind ETA Alphabet Letter Tiles, 278 Lowercase Tiles"
2487,"FATHEAD Bumblebee-Huge Officially Licensed Transformers Removable Wall Decal, 52"" W x 66"" H"
2488,Toysmith X-Stream Glider Twin Pack (5-Inch)
2489,"Rhode Island Novelty 12 Little Zoo Animals Toy Figure, 2.5 Inch"
2490,Onirim
2491,"Playtek Pool Float Tootsie Roll Noodle, Brown"
2492,Aeromax Astronaut Space Pack Super Water Blaster and Astronaut Drawstring Backpack (2 Piece Bundle)
2493,"Disney Minnie Mouse Toddler Girls' Costume, Pink"
2494,Dungeon Crawl Classics Lankhmar Map
2495,Funko Pop! Marvel: 80th - Marvel Girl
2496,DJECO BigaBasic Wooden Puzzle
2497,Baby Fanatic NFL Denver Broncos Unisex DEB440Teether/Rattle - Denver Broncos
2498,K'NEX Thrill Rides – Cobweb Curse Roller Coaster Building Set – 473Piece – Ages 9+ Construction Educational Toy Building Set
2499,"LEGO Ideas 21318 Tree House Building Kit, New 2019 (3036 Pieces)"
2500,Disney Frozen 2 6-in-1 Game House for Kids & Families
2501,"MerryMakers Pout-Pout Fish Plush Doll, 9-Inch"
2502,Roblox Cannoneers: Battle for Jolly Island Game Pack
2503,Buffalo Games - Vivid Collection - Happy Hour - 300 Large Piece Jigsaw Puzzle
2504,Walthers Trainline Walthers Trainline 40' 4-Bay Offset Hopper Canadian Pacific #361094
2505,"Safari Ltd Desert TOOB, Pack of 11"
2506,"Goodman Games Dungeon Crawl Classics Role Playing Game, Softcover Edition"
2507,KIDS PREFERRED Beatrix Potter Peter Rabbit Jack-in-The-Box
2508,PlayGo Giraffe Activity Buddy Crib Toy
2509,Playskool Heroes Marvel Super Hero Adventures Iron Man and Marvel’s Hawkeye
2510,"Glitter Girls by Battat – A Putt with a Cherry on Top! Mini Putt Playset – Toys, Games, and Accessories for 14-inch Dolls – Ages 3 and Up"
2511,Rubie's - Star Wars Classic Chewbacca Deluxe Costume
2512,"GUND Aggretsuko Rage, Multicolor, 7"
2513,"amscan Marvel Epic Avengers Beverage Napkins, Party Favor, Standard, Multicolor"
2514,Buffalo Games - Charles Wysocki - The Three Sisters - 300 Piece Jigsaw Puzzle
2515,Crossfire
2516,38010401 Max8 ESC Combo with EzRun 2200kV Motor TRX Plug
2517,Roller Derby Slide Street Surf Skateboard Black Sox
2518,National Geographic Plush Mountain Lion stuffed Animal Plush Toy Medium
2519,Good Smile Racing Hatsune Miku Gt Project: 1: 43 AMG 2017 SPA24H Version Miniature Car
2520,Cressi Adult Powerful Efficient Open Heel Scuba Diving Fins | Frog Plus: made in Italy
2521,The Learning Journey My First Big Floor Puzzle – Woodland Friends – 12-Piece Toddler Puzzle (2 x 1.5 feet) – Educational Gifts for Boys & Girls Ages 2 and Up
2522,Genesys Roleplaying Dice Pack
2523,"Qualatex Mickey Mouse 1st Birthday, 22 inch Single Bubble Balloon"
2524,Wham-O Splash Unicorn Pool Float 8.3 x 7.4 x 2.3 inches White and Yellow 1 pc
2525,"Rite Lite Chanukah Sing-Along Microphone Toys & Games, Blue"
2526,"Great Eastern Entertainment Dragon Ball Super-SS Vegeta 01 6.5"" Plush"
2527,Funko Pop! Animation: Yu Hakusho - Botan
2528,Daron Skymarks KLM 777-300 1/100 with Wood Stand & Gear
2529,"LEGO Hidden Side El Fuego’s Stunt Truck 70421 Building Kit, Ghost Playset for 8+ Year Old Boys and Girls, Interactive Augmented Reality Playset, New 2019 (428 Pieces)"
2530,"Alex Discover Ready, Set, Cut Kids Art and Craft Activity"
2531,Italeri 4705S 1: 12 Fiat Abarth 695 SS/ Assetto Corsa Model Building Kit
2532,Creative Cedar Designs Playset Telescope Accessory
2533,B. toys – Happy Go Puppy – Wooden Pull Toy – Walk-A-Long Pull Toy For Toddlers 18 Months+
2534,"Click n' Play Green Building Brick Baseplates - 5""x 5"" - (Pack of 4) Tight Fit-Lego Compatible"
2535,"INOVART Black Scratchboard 11"" x 14"""
2536,"KidKraft Wooden Farmhouse Table & 4 Chairs Set, Children's Furniture for Arts & Activity – Natural"
2537,"Aurora 12"" Rainbow Chameleon"
2538,"Intelligent Design Waterfall Comforter Set Twin/Twin XL Size - Grey, Ruffles – 4 Piece Bed Sets – Ultra Soft Microfiber Teen Bedding for Girls Bedroom"
2539,"Fisher Price Kid-Tough Apptivity Case for Kindle Fire, Blue (will not fit HD models)"
2540,"Adora Baby Doll Accessories Pink High Chair, Can Fit Up to 16 inch Dolls, 20.5 inches in Height, Baby Pink and Grey Print"
2541,Universal Trampoline Pole Cap by Upper Bounce
2542,The Unofficial Gamer's Adventure Series Box Set: Six Thrilling Stories for Minecrafters
2543,"Forum Novelties Deluxe Designer Collection Flower Power Costume, Child Medium"
2544,"Amscan 12 Count Pokemon Foil Swirl Decorations, Multicolor"
2545,Gmade 57000 1/10 GS02 BOM 4WD Ultimate Trail Truck Kit
2546,"Maxim Enterprise 6"" Straight Track (4-Piece)"
2547,"Anagram International A11362002 Oklahoma City Thunder Flat Party Balloons, 18"", Multicolor"
2548,Vallejo Panzer Aces Paint Set
2549,"Artool Freehand Airbrush Templates, Diamond Plate"
2550,Scientific Explorer Glow in The Dark Fun Lab Kids Science Experiment Kit
2551,Batman The Dark Knight Joker Large Pet Costume
2552,"Greenlight 86545 1: 43 Vanishing Pt. (1971) - 1970 Dodge Challenger R/T Die-Cast Vehicle, Multicolor"
2553,Waboba NASA Moon Ball for Outdoor Bouncing
2554,"Taggies Crinkle Me Baby Toy, Sherbet Lamb"
2555,ALEX Toys Artist Studio 8 Scented Markers
2556,"Barbie Skipper Babysitters Inc. Feeding and Bath-Time Playset with Color-Change Baby Doll, Tub and 6 Accessories"
2557,Pitsco Laser-Cut Basswood Trebuchet Kit (Individual Pack)
2558,Fun Express Large PVC Dynamite Dinosaurs - Toys - 12 Pieces
2559,"Ravensburger Brilliant Balloons Large Format 500 Piece Jigsaw Puzzle for Adults – Every Piece is Unique, Softclick Technology Means Pieces Fit Together Perfectly"
2560,"GUND Hello Kitty 45th Anniversary, 17"""
2561,"SunWorks Construction Paper, Turquoise, 9"" x 12"", 50 Sheets"
2562,Fantasy Flight Games Runewars: Darnati Warriors Expansion Pack
2563,"Franklin Sports 48"" Authentic Foosball Set"
2564,Charades Women's Pirate Lady Vixen Costume Blouse
2565,Friday The 13th Jason Pet Costume
2566,Mens Vintage Hollywood Tuxedo Costume
2567,Rose Art LAUR DIY Letter Board Kit
2568,Factory Entertainment Ghostbusters Slimer Premium Motion Statue
2569,Bell Child and Toddler Cars Bike Helmets
2570,"Bigjigs Toys Turquoise Rag Doll Cardigan and Flowery Dress for 13"" Bigjigs Toys Soft Doll with Additional Matching Hair Accessories"
2571,Arcane Tinman Dragon Shield Sleeves - Matte Yellow Card Sleeves
2572,Li'l Woodzeez Animal Figurine Playset & Accessories - Baby Sitter Set - 14Piece
2573,"Rubie's Despicable Me 2 Female Minion Costume, Blue/Yellow, Infant"
2574,Zombicide: Invader: Deck Holders Set
2575,"Melissa & Doug Shape Sequence Sorting Set (Wooden Toy, Great Gift for Girls and Boys - Best for 3, 4, 5, and 6 Year Olds)"
2576,"AMSCAN Skeleton Tank Top Halloween Costume Accessory for Women, One Size"
2577,Remo DP0250-00 21-Piece Drum Set Assorted Travel Percussion Pack
2578,Green Toys Convertible Vehicle with Character
2579,"Amscan Bow Tie, Party Accessory, Green"
2580,Fischertechnik Dynamic XS Building Kit (70 Piece)
2581,"Chic Jeans & Peasant Blouse - Fits 18"" American Girl Dolls"
2582,Forum Novelties Women's Simply Elf Costume
2583,Dungeon Roll Dice Game
2584,"Walthers Z, N, HO, S, O, G Scale Layout Control System - Switch Machine (Vertical Mount)"
2585,B. toys – Oddballs - 4 Sensory Toy Balls in Warm Colors for Toddlers Aged 6 Months +
2586,Esdevium HMS Dolores Card Game
2587,"Bee Paper Bleedproof Marker Pack, 11-Inch by 14-Inch, 50 Sheets per Pack"
2588,Bloco Toys Ogre & Monsters | STEM Toy | DIY Building Construction Set (280 Pieces)
2589,Babalu Kids Umbrella - Childrens 18 Inch Rainy Day Umbrella - Dinosaurs
2590,Underwraps Colonial Girl Costume
2591,Mega Construx Call of Duty General Davis
2592,"Rubie's DC Superhero Girl's Harley Quinn Costume, Medium"
2593,Slither.io™ Birthday Candle
2594,Mega Bloks Thomas & Friends Blue Mountain Team-Up Building Kit
2595,Eaglemoss The Walking Dead Collector's Models: The Governor Figurine
2596,Zing Klikbot Studio Pack - Klonk - Orange
2597,Bezier Games Palace of Mad King Ludwig
2598,Toomies Shake and Sort Toy Cupcakes
2599,Kids on Bikes Roleplaying Game Core Rule Book
2600,Licenses Products Sublime Drunk Clown Sticker
2601,Cardinal Double 91 Color Dot Dominoes in Collectors Tin (Styles May Vary)
2602,WikkiStix Animal Activity Pak
2603,Paw Patrol Step Stool Toy
2604,Educational Insights GeoSafari Rockin' Reactions Chemistry Set
2605,In the Breeze Silver Mylar Pinwheel - Sparkly Silver Spinners - Good Animal & Bird Deterrant - 8 Piece Bags
2606,Papo Quetzalcoaltus
2607,Matchbox Jurassic World Portable Playset Harbor Rescue Playset
2608,Funko Pop! Animation: Scooby Doo- Shaggy with Sandwich
2609,"Axial Wraith 1.9 1/10 Scale Electric 4WD RTR RC Rock Crawler with 2.4GHz Tx/Rx System, Black"
2610,"Bachmann Industries Large ""G"" Scale - Manual Turnout - Right Steel Alloy Track"
2611,MasterPieces Dean Russo - The Best Things in Life 300pc EzGrip Puzzle
2612,Infantino Linkable Trunk and Tags Toy
2613,NFL Rally Paper Crinkle Toy - Minnesota Vikings
2614,Fun World White Floating Ghost Costume for Kids
2615,"PLUS PLUS - Construction Building Toy, Open Play Set - 1200 Piece - Pastel Color Mix"
2616,Skywalker Trampolines Mini Trampoline with Enclosure Net
2617,Easy Model T-34/85 Egyptian Army Model Kit
2618,"Wild Republic Wind-Up Boats Tube, three color boats, yellow, green and blue, water activities, eco boat"
2619,Junior Learning Early Accelerator Set 1
2620,"Disney's Mickey Mouse, ""A Classic"" Micro Raschel Throw Blanket, 46"" x 60"", Multi Color"
2621,Mayfair Games Isle of Skye: Journeyman Expansion
2622,"The Puppet Company Dinosaur Fingers - Pterodactyl Children Toys Puppets,"
2623,"DC Collectibles Artists Alley: Batgirl (Black & White Variant) by Chrissie Zullo Designer Vinyl Figure, Multicolor"
2624,Revell '69 Chevy Nova Yenko Plastic Model Kit
2625,Happy Trails Cow Plush Rocking Animal
2626,"Amscan 241143 Party Décor, Assorted Sizes, Black/White"
2627,Manhattan Toy Winkel Monkey Rattle & Sensory Teether
2628,Infantino Stack & Spin Seal
2629,Fantasy Flight Games Elder Sign
2630,"Alvantor Floral Garden 2 Tunnel Playhouse Toddler Playground Kids Play Tent Indoor and Outdoor Pink Princess House Great Game and Toy Gift for Children Fun, 75.6""x44""x37"""
2631,"Rainbow Loom Alpha Bands Craft Accessory, Gray"
2632,"Rubie's Marvel Spider-Man Far from Home Child's Mysterio Costume, Large"
2633,"Fisher-Price Little People Big Helpers Home, Blue (Frustration Free Packaging)"
2634,"ETA hand2mind Manipulite 3 Color Dot Dice, 5/8"", Set of 72"
2635,Eureka Muppets Star Paper Cut Outs
2636,Breyer Stablemates Wild at Heart Horse Toy Set | 4 Horse Set | 1:32 Scale | Model #6035
2637,"Aurora World 16602 8"" Tanya Plush Toy"
2638,"Bachmann Trains E-Z TRACK REVERSING 18"" RADIUS CURVED (4/card) - NICKEL SILVER Rail With Grey Roadbed - HO Scale"
2639,Crocodile Creek 384120-7 Kinder Puzzle Piraten Party 24-teilig 28x38 cm
2640,"Aurora World Destination Nation Leopard Plush, Multi, Small"
2641,"Forum Novelties Deluxe Santa Claus or Pirate Belt (50"" Inches)"
2642,Barbie Breakfast Accessory Pack
2643,"Dreamworks Dragons, Lightfury Deluxe Dragon with Lights & Sounds, for Kids Aged 4 & Up"
2644,"ModMom Owyn Toy Box, Tan"
2645,Rubie's Marvel Captain Marvel Child's Kree Costume Suit
2646,"Aardvark 61500210 Unwrapped Paper Giant Drinking Straw, 9/32"" Diameter x 7-3/4"" Length, White (8 Boxes of 350)"
2647,Chessex CHX27515 Dice-Vortex Slime/Yellow Set
2648,Hey! Play! Wood 3-in-1 Chess Backgammon Table
2649,CollectA Woodlands Red Squirrel (Eating) Miniature Toy Figure - Authentic Hand Painted Model
2650,Playgo Musical Spinning Wheel
2651,"Melissa & Doug Pets Wooden Chunky Jigsaw Puzzle - Dog, Cat, Bird, and Fish (20 pcs)"
2652,Challenge of The Superfriends Card Game
2653,Signs 4 Fun NTIDL3 Stooges-Larry's Driver's License
2654,"Learning Resources Classroom Liquid Measuring Set, Science Classroom Accessories, Teacher Aids, 19 Piece Set, Grades K+, Ages 5+"
2655,Spalding NBA Neverflat Indoor/Outdoor Basketball
2656,"Home Dynamix Harper Ash Accent Rug, 48"" Round, Gray"
2657,Rubie's Adult Star Wars Darth Vader Glovelettes
2658,ATOM Pulse Outdoor Quad Skating Wheels Green set of 4
2659,Ceaco Undersea Glow Journey of The Sea Turtles Jigsaw Puzzle
2660,"California Costumes American Patriot Child Costume, Medium"
2661,"Pokemon Center Black and White Plush Doll Pokedoll - 5"" Monmen/Cottonee"
2662,Fantasy Flight Games Sw Destiny: General Grievous Starter Set
2663,Looney Labs Mad Libs The Game
2664,"PDP Pixel Pals Ren & Stimpy Stimpy Collectible Lighted Figure, 878-040-NA-STM"
2665,"Hot Wheels Minion Dave Vehicle, 1:64 Scale"
2666,"alphamax Yosuga No Sora: Kasugano (Kimono Version) 1: 7 Scale PVC Figure, Multicolor"
2667,"John Deere Deluxe Vehicle Value Toy Set, Pack of 3"
2668,"Forum Novelties 70935 Party Supplies, 30.5 x 1.3 x 25.4 Cm, As Shown"
2669,"DIAMOND SELECT TOYS Marvel Gallery: Avengers Infinity War Movie Doctor Strange PVC Diorama Figure, Blue"
2670,Delta Plush Toy w Sound
2671,"Didax Educational Resources Unifix 1-10 Value Boats - Set of 10, Gray"
2672,4M Spy Science Secret Messages Kit
2673,amscan Plastic Bucket | White | Party Accessory | 12 Ct.
2674,"Caillou Rosie Plush Doll 16"" Rosie Plush Doll"
2675,Ty Whimsy - Sequin Purse
2676,Power Rangers Red Ranger Mighty Morphin Muscle Costume for Toddlers
2677,Nerf N-Strike Elite Rhino-Fire Blaster (Amazon Exclusive)
2678,Confetti | Disney Tiana Enchanted Collection | Party Accessory | 12 Packs
2679,Poolmaster Big Daddy Lounge Ride-On
2680,"Ravensburger 13593 Gone Fishin' 300 Piece Large Pieces Jigsaw Puzzle for Adults - Every Piece is Unique, Softclick Technology Means Pieces Fit Together Perfectly"
2681,California Costumes Women's Size Rich Witch Plus Costume
2682,"Dark Horse Deluxe Game of Thrones 3"" Embroidered Patch Stark"
2683,hand2mind Large Barn Owl Pellets (Pack of 50)
2684,"LEGO Trolls World Tour Volcano Rock City Concert 41254, Cool Trolls Toy Building Kit for Kids, New 2020 (387 Pieces)"
2685,"Ultimaxx Phone Monitor Sun Shade Cover Tablets Pad Hood for DJI Phantom 4/3, Mavic Pro, Inspire, OSMO, M600 Monitor Remote Controller (Small Tablet 8 Inch)"
2686,"Funko 35922 POP! WWERonda Rousey, Multicolor"
2687,Red Metallic Hearts Confetti | Party Decor
2688,"Artool Freehand Airbrush Templates, Freehand Temp Radu Vero"
2689,Playskool Heroes Transformers Rescue Bots Academy Hot Shot
2690,Forum Novelties Women's Big Baby Oversized Costume Bib and Bonnet Set
2691,"Amscan Disney/Pixar""Incredibles 2"" Deluxe Wearable Mask, Party Favor, One Size, Multi Color"
2692,Manhattan Toy Bounce Baby Rattle Activity & Development Toy
2693,Mongoose Kids Mountain Bike Helmet Zone Collection
2694,B. Toys – Let's Glow Bowling! – Multicolored Six Pin Toy Bowling Set with Flashing Light-Up Ball & Carrying Caddy for Kids Ages 2+
2695,"Banpresto One Piecelady Edge: Wedding-Perhona-(B Special Color Ver) Toy, Black"
2696,"E-flite 150mAh 1S 3.7V 45C LiPo Battery, EFLB1501S45"
2697,"Mystery Minis: Harry Potter Series 3 (One Mystery Figure), Multicolor"
2698,"Blue Rabbit Play Outdoor Toddler Slide, 4 Feet, Turquoise"
2699,"Eureka Dr. Seuss ABC Alphabet Bulletin Board Set and Classroom Decorations for Teachers, 14 ft"
2700,"Melissa & Doug Wooden Multi-Craft Weaving Loom (Arts & Crafts, Extra-Large Frame, Develops Creativity and Motor Skills, 16.5"" H x 22.75"" W x 9.5"" L)"
2701,"Mepps Aglia Plain Treble Fishing Lure, 1/6-Ounce, Hot Fire Tiger"
2702,Bigjigs Rail Low Level Track Expansion - 25 Piece Set - Other Major Wooden Rail Brands are Compatible
2703,"Elegant Baby Bedtime Huggie Puppy, Brown/White"
2704,Busch 1682 Rusted Steel Mats Load HO Scenery Scale Model Scenery
2705,12 Inch Trolls Girls' Bike
2706,Disney Toy Story 4 Oversized Coloring and Activity Art Case AS45676
2707,TCG Toys Ooops!
2708,Rubies Baby Ninja Infant Fighter Costume
2709,"AmscanGiant Party Confetti Cannon, 24"""
2710,Banzai Battle Blast Adventure Inflatable Water Park
2711,"PAW Patrol Boys' Toddler Group Short Sleeve T-Shirt, Navy Heather, 3T"
2712,Kidz Science Erupting Volcano Kit
2713,Hauck FurReal Pet Grooming Mobile Salon and Spa Carrying Case with 11 Accessories
2714,Bachmann Industries 40' Quad Hopper & O #71511 (HO Scale)
2715,"SignMission Hot Dogs Chips and Soda Combo 48"" Banner Concession Stand Food Truck Single Sided, Size: 18"" X 48"""
2716,Banpresto 39652 Dragon Ball Super Blood of Saiyans Special VI S.God Goku Figure
2717,"Classic Bouquet Jigsaw Puzzle, 1000-Piece"
2718,"Urban Habitat Kids Callie Comforter Reversible 100% Cotton Jacquard Weave Colorful Poms Dots Soft Overfilled Down Alternative Hypoallergenic All Season Bedding-Set, Twin, Multi"
2719,Mudpuppy At the Stable Pixel Pictures
2720,"Ravensburger Tranquil Sunset 14833 500 Piece Puzzle for Adults, Every Piece is Unique, Softclick Technology Means Pieces Fit Together Perfectly"
2721,Daron Skymarks Alaska 737-900 1/130 2016 Livery SKR875
2722,Preiser 14414 Funfair Visitors Package(30) HO Model Figure
2723,Bristle Blocks by Battat – The Official Bristle Blocks – 85 Pieces in a Carry Case – Creativity Building Toys for Dexterity and Fine Motricity – BPA Free 2 years +
2724,Swimline Giant Swan and Giant Flamingo for Swimming Pools
2725,"Avengers Marvel Legends Series Endgame 6"" Collectible Action Figure Captain America Collection, Includes 1 Accessory"
2726,Weta Workshop 870100985 Hobbit Statue Bombur 1:6 Scale 1:6
2727,"Creative Converting 332423 Pineapple and friends Napkins, 6.5"", Multicolor"
2728,"Dungeons & Dragons - Tyrants of the Underdark ""Aberrations & Undead"" Game Expansion"
2729,Cards Against Humanity: Hidden Gems Bundle
2730,"MasterPieces NFL Houston Texans Stadium Panoramic Jigsaw Puzzle, 1000 Pieces"
2731,Simon Game
2732,Toy Story Disney/Pixar Interactive True Talkers Bunny and Ducky 2-Pack
2733,"DC Collectibles Artists Alley: Two-Face by James Groman Designer Vinyl Figure, Multicolor"
2734,"Crayola Mini Twistables Crayons, 24 Classic Colors Non-Toxic Art Tools for Kids & Toddlers 3 & Up, Great for Kids Classrooms Or Preschools, Self-Sharpening No-Mess Twist-Up Crayons"
2735,Edu-Toys Power Tech Super Chem 120
2736,"Coraline - Other Mother Collectible Figure, Multicolor"
2737,Blue Orange CooCoo
2738,"Fisher-Price Nickelodeon Shimmer & Shine, Teenie Genies, Genie Gem Cruiser"
2739,DC Comics: Batman (with Bonus Part) Ikemen Statue
2740,Wardlings: Boy Rogue & Monkey
2741,"Rubie’s DC Comics Batman Muscle Chest Costume, Small"
2742,Bachmann Trains Snap-Fit E-Z TRACK LAYOUT EXPANDER SET - NICKEL SILVER Rail With Grey Roadbed - HO Scale
2743,L.O.L. Surprise! Winter Disco Bigger Surprise includes O.M.G. Fashion Doll (Amazon Exclusive)
2744,"Kick Push Aluminum hub Scooter Wheels with Bearings, Green/White, 100mm"
2745,"Patriotic Fabric Bunting (red, white, blue) Party Accessory (1 count) (1/Pkg)"
2746,Dragon Costume for Infants
2747,"Age of Cthulhu 9: The Lost Expedition (Officially Licensed Cthulhu Adv., Hardback)"
2748,"G-Made 70106 1.9 VR01 Beadlock Wheels, White (2)"
2749,Junior Learning Homonym Puzzles
2750,Aquarius Frosty The Snowman Playing Cards
2751,"Exploding Kittens Card Game - Family-Friendly Party Games - Card Games for Adults, Teens & Kids & Streaking Kittens: This is The Second Expansion of Exploding Kittens"
2752,Dreamworks Trolls BFF Blanket
2753,School Smart Conical and Fineline Watercolor Combo Marker Pack - Pack of 192-12 Each of 8 Assorted Colors - 086417
2754,Rubie's Costume Batman v Superman: Dawn of Justice Trick or Treat Pail
2755,Carrera 61617 2/45 Curve Track Section Part for Use with GO!!! and Digital 143 - Pack of 4
2756,"Kent Twinkle Girls' Bike, 12-Inch"
2757,Eaglemoss Harry Potter's Wizarding World Figurine Collection: Hagrid Figurine
2758,Kotobukiya Star Wars The Force Awakens Han Solo & Chewbacca Two Pack Artfx+
2759,ORB Slimy Elasti Plasti Tootables Dog - Make Giant Fart Bubbles & Funny Noises
2760,"Jada Toys Marvel Iron Man & 2016 Chevy Camaro Die-cast Car, 1:24 Scale Vehicle & 2.75"" Collectible Metal Figurine"
2761,INOVART Presto Foam Econo Pak Printing Plates
2762,"BEYBLADE Burst Turbo Slingshock Ogre O4 Single Battling Top, Right-Spin Attack Type, Age 8+"
2763,LeapFrog RockIt Twist Dual Game Pack: Trolls Party Time With Poppy and Cookie's Sweet Treats
2764,"Melissa & Doug Wooden Get Well Doctor Activity Center - Waiting Room, Exam Room, Check-in Area"
2765,"SainSmart Jr. Remote Control Dinosaur Robot Toy 2-in-1 Electronic Walking Dinosaur with Sound, Infrared Control Roaring Dino for 3+ Kids, Triceratops"
2766,Connelly Party Cove Island Water Mat
2767,"Amscan 380064 Baby Shower Statistics Sheet, 40""x30"", Multicolor"
2768,"Oasis Supply Candy Stripe Birthday Candles, 2.5-Inch, White"
2769,Champion Sports Playground Ball
2770,"MasterPieces Cottage Linen Jigsaw Puzzle, Stoney Brook, Featuring Art by P.D & Moreno, 1000Piece"
2771,Scientific Explorer My First Science Kids Science Experiment Kit
2772,Pkgd Foil Horns (silver) (15/Pkg)
