1347,Colorforms Brand Despicable Me Create a Story Restickable Set
1348,Trends International My Little Pony - Pop Up Stickers - 4 X 8
1349,"""Numeric Candle, #4"""
1350,"Estes Standard Engine Igniter Plug, Magenta/Yellow"
1351,Florida-Opoly
1352,"Fisher-Price Infant-to-Toddler Rocker, Jungle Fun"
1353,CLOVER 8462 Flower Frill Templates Extra Small and Mini Sizes
1354,"Carson-Dellosa Publishing Language Arts Learning Games, Grade 2"
1355,"Perler Beads Forest Animals Fuse Bead Kit, 2000pcs, 7 Projects"
1356,"Toysmith Get Outside GO! Neon Dart Ball Set, Packaging may vary"
1357,Rubie's Rag Doll Children's Costume
1358,Bachmann Trains Thomas & Friends - Cranky The Crane
1359,"Aurora World Sea Sparkles Mermaid, Bride"
1360,Sunny Days Entertainment Bendems Collectible Posable Figures - Bob's Burgers: Bob
1361,"Rubie's Costume Captain America: Civil War Black Panther Child Top and Mask, Small"
1362,Dickie Toys Air Pump Garbage Truck
1363,Funko Pop! Animation: Rick and Morty Lawyer Morty Collectible Figure
1364,"Constructive Playthings Tree Blocks, Set of 36 Hand-Cut Wood Pieces, Various Shapes and Shades, STEM Approved"
1365,Walthers Cornerstone HO Scale Hardwood Furniture Factory Structure Kit
1366,Woodland Scenics P358 Pine Car Derby Dry Graphite Lubricant .22 Ounces
1367,Charley Harper Monteverde 1000 Piece Jigsaw Puzzle
1368,"Aurora World 9"" I Love You Corgi"
1369,Haywire Group Flickin' Chicken
1370,Marvel Hulk Fist Pewter Key Ring
1371,Silver Glitter Hanging Fans (4 ct)
1372,"Learning Resources Base Ten Blocks Smart Pack, Early Childhood Math Skills, Ages 5+"
1373,Alex Studio Expressions Easel Case Artist Set Kids Art Supplies
1374,"Barbie Outdoor Furniture Set, Brick Pizza Oven"
1375,COBI Small Army A12 Matilda Tank
1376,Illustrated Faith - Stickers - Word Art
1377,American Girl WellieWishers Garden Adventure Picnic for WellieWisher Dolls
1378,"Odyssey Toys Hape Chunky Number Puzzle (10 Pieces), Multicolor, 5'' x 2''"
1379,Gamewright Too Many Monkeys
1380,"Badger Basket Chevron Upholstered Doll Sofa with Foldout Bed (fits American Girl Dolls), Pink/White"
1381,"ebba Baby Talk Carrier, My Pirate Ship Playset"
1382,"Prism Skate Co Biscuit Artist Series Skateboard at 6.5 lb, Blue, 28"" x 8"" 5.25"""
1383,"Sammons Preston Replacement Cover for Mini Exercise Trampoline, Optional Cover for Small Trampoline, Durable Frame Cover for Home or Clinical Use"
1384,"KidKraft Wooden Espresso Smoothie Set with Pretend Fruits & Vegetables Play Food, Removable Lid"
1385,Rhode Island Novelty 5 Inch Smile Face Playground Ball
1386,"Darice Wood Barn Bird House, 8-Inch, Natural"
1387,Smart Play Ingenio Colors & Shapes Memory Match Game
1388,"up4 Mickey Grab N Go Play Pack 8.50x5.25x0.5 [Contains 8 Retail (S) Per SKU# 1051224, Multicolor"
1389,L.O.L. Surprise! O.M.G. Winter Disco Dollie Fashion Doll & Sister
1390,"Poolmaster Vinyl Water Hammock, Blue"
1391,"ICS RC Cars, AMOSTING 35MPH 1/12 Scale 2.4GHz 2WD High Speed Off Road Remote Control Car Monster Trucks"
1392,Originals Aquaman DC Comics Superman Zombie String Doll Keychain
1393,Color My Heart Pendant Necklace Craft Kit
1394,"Rubie's Justice League Child's Deluxe Aquaman Costume, Large"
1395,"Learning Resources Primary Science Deluxe Lab Set, Science Kit, 45 Piece Set, Ages 3+"
1396,Swimline Pool Jam Inground Basketball
1397,Forum Novelties Children's Unisex Headless Costume
1398,Funko Pop! Animation: Scooby Doo - Clown
1399,"NEBULOUS STARS Marinia's Secret Diary, Motif Applicator Pen & Ball Pen & Lock Included, Multicolor"
1400,Glitter Girls by Battat – Flutter and Sparkle Shoes and Leggings Accessory Set – 14-inch Doll Clothes and Accessories for Girls Age 3 and Up – Children’s Toys
1401,Little Buddy Super Mario All Star Collection 1448 Lakitu/Jugemu Stuffed Plush
1402,C.R. Gibson Little Lamb's Perfect Day Board Book and Stuffed Animal Set for Newborns and Babies
1403,Pressman Toys Giant Snakes & Ladders Game (4 Player)
1404,Testors TENAMEL-1253T Aerosol Enamel Paint 3oz-Gray Metallic
1405,Banpresto Love Live! Exq Figure Kotori Minami
1406,Bandai Tamashii Nations S.H. Figuarts Zero Megaman Zero Model Kit
1407,Elenco Breadboard with 830 Tie Points - 9425
1408,"Rubie's Marvel: Avengers Endgame Child's Captain America Costume & Mask, Medium"
1409,DreamWorks Trolls Biggie Talkin’ Troll Plush Doll
1410,Buffalo Games - New York Twilight - 300 Large Piece Jigsaw Puzzle
1411,"Hohner Kids MP383 Musical Shapes, 20 Piece, 3 Unique Shapes, Assorted Colors"
1412,Rubie's Costume Co Baby Boys' Sonic Romper Costume
1413,Steiff Harry Potter Plush Keychain
1414,Inlaid Cribbage Box with Cards
1415,"Vallejo Umber Wash, 17ml"
1416,Redcat Racing BS213-017 Blackout Chassis
1417,Fashion Angels Garbage Can of Sand Art Fun (12291) Makes 3 Sand Art Pendants For Ages 3 and Up
1418,Ninja Division NAS Howl & Yip Board Game
1419,"Fisher-Price Nickelodeon Shimmer & Shine, Dragon Rider Farnaz"
1420,"Pyle Megaphone Speaker PA Bullhorn - with Built-in Siren 50 Watts Adjustable Volume Control & Record Function - Ideal for Football, Baseball, Cheerleading Fans, Coaches or for Safety Drills PMP58U"
1421,"Creativity Street Round Beginner Paint Brushes, 10 Pack (AC5137)"
1422,EuroGraphics (EURHR Backyard Fun Dog by Gary Patterson 300Piece Puzzle 300Piece Jigsaw Puzzle
1423,Learning Resources Attribute Beads Set
1424,Licenses Products DC Comics Originals Batman Logo Wristband
1425,"Aurora 10817 8"" Tiger Plush Toy, Small, White"
1426,"Inflatable MegaMorph Fat Suit Costume For Adults And Children, Available in Various Designs"
1427,"Aurora World Plush Graduation Bear, White Cap, 8.5"""
1428,Bloco Toys Inc The Chimpanzee
1429,Tachikara T-Rope Tetherball Attachment Rope
1430,"Lunchskins LS4-TOTE-STRIPE-NAV Reusable Tote, Navy Blue Stripe"
1431,EuroGraphics 5425 Frida Portrait Puzzle (1000 Piece)
1432,Entertainment Earth Guardians of The Galaxy Groot Tiki Totem Action Figure
1433,"Loftus SW-0249 4 Pc Classic Wooden Games in A Tin Set, 6 inches Long, Brown"
1434,"Hampton Nautical Red Painted Lifering with White Bands, 20"""
1435,"Aurora 8"" Pink Unicorn"
1436,Harry Potter Ron Weasley Yule Ball Doll
1437,"LeapFrog Learning Friends 100 Words Book, Green"
1438,"Learning Resources Dino Math Tracks Game, Place Value, Counting, Addition and Subtraction Dinosaur Game, Ages 6+"
1439,"Star Wars Child's Boba Fett Costume, Medium"
1440,Kid's Cowboy Wall Vinyl Sticker Growth Chart 2ft - 5ft - Black
1441,LOL Surprise Fashion Tape Dress by Horizon Group USA
1442,"Melissa & Doug Star Diner Restaurant (Play Set & Kitchen, Wooden Diner Play Set, Two Play Spaces in One, 35"" H x 23"" W x 43.5"" L, Great Gift for Girls and Boys - Best for 3, 4, 5 Year Olds and Up)"
1443,Elenco Line Tracking Robot Kit
1444,Nerf Sports Pro Grip Football (blue football)
1445,Lord of the Rings LCG: The Road Darkens
1446,Rubie's Costume Co Cleopatra Headpiece-Mesh Costume
1447,"""Happy New Year"" Silver Plastic Bling Necklace | Party Accessory, 6 Ct"
1448,"Marvel Avengers 2-In-1 Muscle Chest Hulk/Captain America Deluxe Costume, Small"
1449,"Edushape Hand Drum Musical Toy, Multicolor"
1450,Style Me Up! Candy Pop to Go Cupcake Purple
1451,Rise of The Teenage Mutant Ninja Turtle Donatello Side Flip Ninja Attack Deluxe Figure
1452,DJECO Batasaurus
1453,"Edupress Common Core Task Cards, Language, Grade 6 (EP63354)"
1454,BathBlocks STEM Floating Construction Set
1455,"Beistle 50354 Party Supplies, 8"" x 5½"" x 5½"", Multicolored"
1456,COBI Historical Collection Battleship Tirpitz
1457,Create-A-Scene Magnetic Playset - Dinosaurs
1458,Star Trek Frontiers (Star Trek Themed Mage Knight) Board Game
1459,Small World Toys Fashion - Bead Gallery Craft Kit
1460,"Neon Super Hero Mask, Party Accessory"
1461,Tamiya 14137 1/12 Street Motorcycle Rider Plastic Model Kit
1462,The Meeples Board Game Addict T-Shirt
1463,Barbie Complete Looks Wonder Woman Fashion FXK83
1464,Rubie's Women's Batman v Superman: Dawn of Justice Wonder Woman Costume Top
1465,CMON Bloodborne
1466,"DII Collapsible Polyester Storage Basket or Bin with Durable Cotton Handles, Home Organizer Solution for Office, Bedroom Closet, Toys, Laundry, Large, Aqua"
1467,ERTL Big Farm Logging Truck with Pup Trailer & Logs
1468,"Jada Toys Fast & Furious Brian's Ford F-150 SVT Lightning, 1:24 Scale Die-Cast Vehicle, Red"
1469,Lord of The Rings Bilbo Baggins Sword
1470,California Costumes Toys Little Mermaid Costume
1471,"Creative Co-op Green & Grey Plush Dinosaur Rattles (Set of 3 Styles) Toys, Green"
1472,Shopkins Season 8 USA Hotdog Stand Playset
1473,"Kinetic Sand, Sandisfying Set with 2lbs of Sand & 10 Tools, for Kids Aged 3 & Up"
1474,"Rubie's Marvel Avengers: Infinity War Deluxe Teen Groot Child's Costume, Medium"
1475,AMERICAN GREETINGS Rainbow Latex Balloons| Pack of 20 | Party Decor
1476,Lippert Components 287298 500:1 Motor - High Torque
1477,"Airfix Quickbuild A01304V Air fix Vintage Classics Churchill MK VII Tank 1, 76 Military Ground Vehicle Plastic Model Kit, Gray"
1478,Disney Pixar Cars Deluxe Van Scanlane
1479,Rubie's Costume Co. Women's Full Length Hooded Cape with Tulle Overlay
1480,Smith Safety Gear Leopard Elbow Pads
1481,World of Nintendo Mario Bros U Boo Plush
1482,amscan Antler Glitter Plastic Fun Shades | Christmas Favor
1483,Disguise Yellow Ranger Beast Morpher Deluxe Girls' Costume
1484,"HQ Flowtail Delta 600 XL- 79 Inch Single - Line Sport Kite, Color: Rainbow - Active Outdoor Fun for Ages 12 and Up"
1485,Harry Potter 9 & 3/4 Platform Soft Touch Magnet
1486,J Concepts 0311 Finnisher - RC8T3/RC8T3E Clear Body
1487,Rubie's Costume Co - Batman Child Gauntlets
1488,"Cyalume 9-2705101, 12"" SnapLight LightStick Industrial Grade, Green, 12 Hour Duration (Case of 25)"
1489,Folkmanis Amazon Parrot Hand Puppet
1490,"Berenguer Boutique 15"" Soft Body Baby Doll - Blue 10 Piece Gift Set with Open/Close Eyes- Perfect for Children 2+"
1491,"RoyalBaby Space Shuttle Kids Bike for Boys and Girls, 14 16 18 Inch Magnesium Bicycle with 2 Hand Disc Brakes, Child's Cycle with Training Wheels or Kickstand, Black White Purple"
1492,Forum Novelties Combat Hero Medals
1493,"SunWorks PAC6525 Construction Paper, 11 Assorted Colors, 9"" x 12"", 300 Sheets"
1494,"Disney/Pixar Zootopia 'Bunny Ears' 3 Piece Sheet Set, Twin"
1495,Safavieh Castle Gardens Collection Dragon Coin Antique White Glazed Ceramic Garden Stool
1496,Pitsco Laser-Cut Basswood T-Bot II Hydraulic Arm with Challenge Set
1497,Tamiya 35157 1/35 U.S. Marine M60A1 Tank Plastic Model Kit
1498,Redcat Racing BS903-089 2 X 10 Pin (12Piece)
1499,"Blaze and the Monster Machines Value Pack Foil Swirl Decorations, Party Favor"
1500,Utah Playing Cards
1501,Folkmanis Mini Goldfish
1502,HANSA Snuggles The Bear Plush
1503,"BePuzzled Original 3D Crystal Jigsaw Puzzle - Rapunzel Disney Tangled Brain Teaser, Fun Decoration for Kids Age 12 and Up, Purple, 39 Pieces (Level 1)"
1504,RoomMates Flower Power Peel and Stick Border
1505,"Amscan 399056 Supplies Camouflage Rubber Bracelet, Party Favor, Pack of 6"
1506,Hape Wooden Railway Big Engine Shed Train Set
1507,Adventure Time Card Wars Sleeve Jake
1508,"Modern Home Toy, 32"", Green"
1509,Redwood Ventures Foodie Surprise Yolkies Surprise Egg
1510,Forum Novelties Men's Deluxe Adult Top Hat
1511,"Forum Novelties 77749 Kids Colonial General Costume, X-Large, Pack of 1"
1512,INNOBABY TEETHIN' Smart Birthstone Ring TEETHER - March (Aquamarine)
1513,Forum Novelties Inc - Mens Boogie Down Shirt
1514,Celtic Dice Bag Board Game
1515,"Burton & Burton 260Q Neon Green Pencil Balloons, Pack Of 100"
1516,"E-flite Propeller 12 x 4E: VisionAire, EFLP12040E"
1517,"Disney KCSEHEA Flip Sequin Heart Keychain 3-4"", Multicolor"
1518,"Gigantosaurus Rocky Plush Dinosaur Mini Figure, Super Soft & Cuddly Plush, Stands 7"" Tall, Perfect for Playtime & Naptime! for Kids Ages 12 Months & Up"
1519,RoomMates Fire Brigade Peel and Stick Wall Decals
1520,Scrabble Junior Game
1521,Redcat Racing 28003 Ni-Ch 7.2V 1100mAh Battery
1522,Prism Bora Single-line Parafoil Kite
1523,"Funko 32751 Pop Movies: Fantastic Beasts 2- Newt (Styles May Vary), Multicolor"
1524,"Decorol 101208 Flame Retardant Paper, White"
1525,Sun-Staches Costume Sunglasses Kids Princess Belle Princess Party Favors UV400
1526,Ultimate Guard Katana Sleeves Standard Size Red (100)
1527,Yummy World
1528,Razor Jr. Lil' E Scooter
1529,Application Misfits Crystal Lake Skull Patch
1530,VTech Go! Go! Smart Wheels Spinning Spiral Tower Playset
1531,Lionel Mega Tracks - Corkscrew Chaos Green Engine
1532,L.O.L. Surprise! Biggie Pet- D.J. K9
1533,My Little Pony Mane Pony Rainbow Dash Classic Figure
1534,Kid Casters No Tangle Rods
1535,#40 Celebration Candle | White/Red | Party Supply
1536,"Plus-Plus BIG - Preschool Construction Building Toy, Open Play Set - 50 Piece - Basic Color Mix"
1537,"Transformers Toys Studio Series 52 Deluxe Revenge of The Fallen Movie Arcee Chromia Elita-1 Action Figure 3 Pack, 4.5"""
1538,Steiff National Geographic - Chinchi Chinchilla
1539,"Aurora World Fantasy Unicorn Plush, One Size, Purple / Pink / White"
1540,"Losi Forward Only Transmission Conv Kit: LST/2, XXL/2, LOSB3130"
1541,"Fashion Angels Hair Chox Set (12167), Hair Chalk Gift Set, Temporary Hair Color"
1542,Disney Minnie Mouse Roadster Racer Toddler Girls' Costume
1543,ALEX Spa Fab Foil Tattoos Pink
1544,Aquarius Marvel Black Panther Retro Playing Cards
1545,Disney Ariel PVC Figure Keyring
1546,"FAO Schwarz Chalk Mandala Set with Assorted Washable Sidewalk Chalk Sticks & Stencils, Set of 38"
1547,Carrera Race Spectators - Set of 15 Detailed Fans - 1:32 Scale Figures - Realistic Scenery Accessory for Slot Car Track Sets
1548,"Aurora Rattlesnake Plush, Green"
1549,Rhode Island Novelty Monkey Bean Filled Plush Stuffed Animal
1550,Vallejo Game Air Warlord Purple Paint
1551,"Orbrium Toys Short Curved Switch Tracks for Wooden Train Railway Fits Thomas Brio Chuggington Melissa Doug Imaginarium, Set of 8"
1552,"Mudpuppy Animals of the World Coloring Roll – Age 3+ - 10 Feet of Creative Coloring Fun – Includes 6 Crayons – Animal Paper Roll Easy to Store, Take on the Go – Great for Individual or Group Coloring"
1553,"Simplicity Creative Group, Inc Boye Learn to Crochet Beginners Kit, 16 Projects"
1554,in The Line of Duty Child Costume
1555,Mastercraft Collection F-22 Raptor Model Scale: 1/48
1556,Duncan Toys Despicable Me Giggling Yo-Yo Toy
1557,Mudpuppy Cats Locked Diary
1558,Funko Dorbz: Assassin's Creed - Edward Action Figure
1559,"Forum Novelties Party Supplies 80407 Plush Monkey Child's Mascot Costume, Medium"
1560,"Heroes of Goo Jit Zu 41012 S1 Ultimate Hero Pk, Multicolor"
1561,FATHEAD AH-64 Apache Longbow Helicopter Real Decals
1562,Pacon Blank Flash Cards - 2 x 3 - Pack of 1000 - Manila
1563,"Blue ""You're Invited"" Sweet Safari Invitation Postcards"
1564,Sesame Street Abby Cadabby On the Go Case
1565,Ceaco Perfect Piece Count Puzzle - Roger Nannini - Acme Flying School
1566,Disney Tangled Rapunzel Secret Journal Toy
1567,Pressman Harry Potter Tri-Wizard Tournament Game
1568,Osmo - Detective Agency: A Search & Find Mystery Game - Ages 5-12 - Explore The World - for iPad and Fire Tablet & 2 Hands-On Learning Games - Creative Drawing & Problem Solving/Early Physics
1569,"The Kids Room by Stupell Yellow Dump Truck with Blue Border Stretched Canvas Wall Art, 16 x 20, Multi-Color"
1570,Little Tikes Big Digger Sandbox
1571,Disney/Pixar Cars Lightning McQueen with Sign Vehicle
1572,"Wildkin 5 Pc Bedding, Twin, Heroes"
1573,DC Comics Deadshot Suicide Squad Pewter Lapel Pin Action Figure
1574,My Little Pony Friendship is Magic Fluttershy Soft Plush
1575,White Mountain Puzzles General Store - 1000 Piece Jigsaw Puzzle
1576,Sweet Jojo Designs 3-Piece Bear Mountain Watercolor Boy Full/Queen Kid Childrens Teen Bedding Comforter Set
1577,Ceaco Emoji Partytime Puzzle (300 Piece)
1578,Kid Galaxy Remote Control Bumper Cars. RC 2 Player Game. 2 Cars and 2 Controllers Included
1579,"Amscan Party Supplies, Multicolor"
1580,"Edupress Mathological Liar Game, Grade 6 (EP63399)"
1581,Funko Pop! Star Wars: Rise of The Skywalker - Knights of Ren Club (Hematite Chrome)
1582,"Great Eastern GE-7044 Ouran High School Host Club - 15"" Kuma-chan Bear Plush"
1583,Air Hogs 2-in-1 Hyper Drift Drone for High Speed Racing and Flying - Green
1584,"Learning Resources Jumbo Reptiles & Amphibians I Tortoise, Gecko, Snake, Iguana, and Tree Frog, 5 Animals"
1585,Learning Advantage QUIZMO Addition & Subtraction - Bingo-Style Math Game for Kids - Help Your Child Learn Essential Elementary Skills
1586,Daron FDNY Ambulance with Lights & Sounds 2019 New
1587,"Banpresto Dragonball Legends Collab-Goku-Black-, Multiple Colors"
1588,Great Eastern Entertainment Dragon Ball Z - Goku vs. Frieza Sublimation Beanie Headwear
1589,Tamiya Models M1A2 Abrams Model Kit
1590,"Ravensburger The Saguenay Fjord Canadian Collection Canadienne 1000 Piece Jigsaw Puzzle for Adults – Every piece is unique, Softclick technology Means Pieces Fit Together Perfectly"
1591,Marvel Legends Deadpool’s Rainbow Squad 5-Pack
1592,Rubies Batman The Brave and Bold Flashlight and Batarang Kit
1593,MightySkins Skin Compatible with Yuneec Q500 & Q500+ Quadcopter Drone wrap Cover Sticker Skins Bandana
1594,Far From Home Spider-Man New Suit Child Mask
1595,"Bright Starts Sesame Street Snack & Stroll Cookie Monster Wooden Pull Toy, Ages 12-36 Months"
1596,Fisher-Price Classic Changeable Picture Disk Camera
1597,BEYBLADE Burst Starter Pack Betromoth B2
1598,"PlayWheels Teenage Mutant Ninja Turtles Roller Skates with Knee Pads, Green/Blue, Junior Size 6-12"
1599,"Creative Converting 8 Count Hot/Cold Cups, 9 oz, Metallic Webs"
1600,Beados Season 7 Shopkins Ice Cream Truck
1601,"7-in-1 Combo Game with Chess, Ludo, Chinese Checkers & More"
1602,"Dragon Ball Z GE-57756 Group Galaxy Throw Blanket, 46 x 60"""
1603,Funko Pop! Disney: Aladdin Jasmine (Red) Collectible Figure
1604,"Disney 96959 Toy Story Ball Pit, 1 Inflatable + 15 Sof-Flex Balls"
1605,Harry Potter Sorting Hat
1606,The Puppet Company Full-Bodied Animal Hand Puppets Bear
1607,"Rubie's Men's Star Wars Collector Stormtrooper Collectors Helmet, Multi, One Size"
1608,DECOPAC Hot Wheels Drift DecoSet Cake Topper
1609,"Glitter Girls by Battat - Convertible Car for 14"" Dolls - Toys, Clothes & Accessories for Girls 3-Year-Old & Up, Blue, Orange, Pink"
1610,JumpSport SkyBounce Trampoline with Safety Enclosure | Includes Spring Pad
1611,Pokemon SM12 Cosmic Eclipse Theme Deck- Groudon
1612,DC Super Hero Girls: Teen to Super Life Supergirl Doll
1613,Warmies Microwavable French Lavender Scented Plush Jr Clown Fish
1614,Performance Tool W5220 200 pc Hex Washer Self Drilling Assortment
1615,"J Concepts 3377B Tribute 2.6x3.6 Monster Truck Wheels with Adaptors, Black (1 Pair)"
1616,"Dr. Ph. Martin's Radiant Concentrated Water Color, 0.5 oz, Set of 14 (Set B)"
1617,"Wood Designs 24"" x 48"" Rectangle Hardwood Table with 29"" Legs"
1618,Diamonsters
1619,"Janlynn Cool Cord Friendship Bracelet Pack, Makes 100 Bracelets"
1620,"WWE Dean Ambrose & Brock Lesnar Action Seried 43 B Figures, 2 Pack"
1621,"Minnie Plush Toy, 25"""
1622,"Waving Flag Party Table Cover, 54"" x 96"""
1623,"Vallejo Acrylic Paint, Khaki"
1624,amscan Cape Hooded Black Child
1625,"Liontouch 316LT Medieval Noble Knight Satin Toy Cape For Kids, Blue | Part Of A Kid's Costume Line"
1626,Hot Wheels Blastin' Rig Vehicle
1627,"MasterPieces Memory Lane Lakeside Memories Cabin Lake Large EZ Grip Jigsaw Puzzle by Alan Giana, 300-Piece"
1628,Roces Icon Fitness Inline Skate
1629,Shomer-Tec Special Ingredients Purple Rain Powder
1630,Airfix Douglas A-4B/Q Skyhawk 1:72 Vietnam War Military Aviation Plastic Model Kit A03029A
1631,DC Fix 334-0025 Phantom Premium Window Film
1632,"Oopsy Daisy Growth Charts Robots and Rockets Navy by Finny and Zook, 12 by 42-Inch"
1633,Rubie's Costume Co Deluxe Native American Headdress
1634,NECA - Nightmare on Elm Street Part 3 - 8” Clothed Action Figure - Tuxedo Freddy
1635,"Chessex CHX27449 Dice-Festive Set, Rio/Yellow"
1636,"Ultra Pro Super Thick 260PT Toploader 10ct Pack 85238, One Size, Multi"
1637,"Relevant Play Constructive Playthings DEL-4 Blue Shape It! Sand 5 lb. Box 10.9"" L. x 2.4"" W. x 7.5"" H."
1638,"Aurora World Off White Love Bear Plush Animal, Multicolor, 11.5"""
1639,"amscan Super Mario Brothers Tattoos, Party Favor, 192 Ct."
1640,"Hey! Play! Coffee Maker Toy Set- Pretend Kitchen Appliance for Play Espresso or Cappuccino Coffee Shop, Single Serve Brewer for Boys and Girls"
1641,White Mountain Puzzles Craft Room - 1000 Piece Jigsaw Puzzle
1642,DJI Smart Controller
1643,Frozen Standing Stocking Olaf The Snowman
1644,"Ginger Ray PO-407 Patchwork Owl Cake Bunting Decoration Party Topper, Mixed, 1"
1645,"Amscam 129877 Soccer Plastic Pennant, 12' Banner, Multicolor"
1646,Redline Acclaim 4.5’ Air Powdered Hockey Table with 110V Motor and Includes 2 Strikers and 2 Pucks
1647,"Kryptonics Mini Cutaway Cruiser Skateboard - Complete 26"" Cruiser Board for Kids & Teens- Mermaids"
1648,"GUND Pusheen Fancy and Unicorn Magical Kitties Plush Deluxe Keychain Clip, Multicolor, 8.5"""
1649,Get Ready Kids 12' Play Parachute
1650,Play Circle by Battat – Making Dinner for Eight Cookware Set – 21Piece Kids Play Pots & Pans Set – Pretend Play Kitchen Set for Kids Age 3 Years & Up
1651,My Little Pony Shining Friends Pinkie Pie Figure
1652,"amscan Party Decorations, Pearlized Place Cards, Party Supplies, White, 4"" x 4"", 50ct, Ivory"
1653,DC Artists Alley: Catwoman by Sho Murase (Holiday Variant) Designer Vinyl Figure
1654,Trends International NFL Atlanta Falcons HG - Mobile Wallet
1655,Rubie's Costume Reel F/X Acid Eye Socket Wound Kit
1656,"Disney Pixar Cars Character Car Dexter Hoover & Charlie Checker Vehicle, 2 Pack"
1657,Mega Brands POK Power PK Kadabra
1658,Plates | Superstar Ball Sports Collection | Birthday | 144 Ct.
1659,"Amscan 453437 Plush Bear, 7"", White"
1660,DC Superhereos Supergirl Nail Art Kit
1661,Dark Horse Deluxe Frank Frazetta The Destroyer Magnet
1662,"MightySkins Skin Compatible with DJI Mavic Pro Quadcopter Drone - Nighttime Skulls | Protective, Durable, and Unique Vinyl Decal wrap Cover | Easy to Apply, Remove | Made in The USA"
1663,Funko Pop! Animation: Disenchantment - Luci
1664,"Furnish my Place 740 Numbers 5X7 Kids ABC Educational Alphabet Letter Anti Skid, 4'5""X6'9"", Multi/Color"
1665,Graupner JST EH to JST XH 4S Board
1666,Bigjigs Toys Stacking Cubes
1667,"Ravensburger The Zoo My First Frame Tray 14 Piece Jigsaw Puzzle for Kids – Every Piece is Unique, Pieces Fit Together Perfectly"
1668,Infantino Turtle Mirror Pal
1669,Play-Doh Tootie The Unicorn Ice Cream Set with 3 Non-Toxic Colors Featuring Color Swirl Compound
1670,"Lionel Trains - Looney Tunes Ambush Shack (Plug-Expand-Play), O Gauge"
1671,Rage RC C1070 20T Pinion Gear: R10ST
1672,"Woody Classic Toy Story 4 Child Costume, M (7-8)"
1673,Sago Mini - Walk &-Play Finger Puppets for Ages 3 and Up
1674,"8-Count Child-Sized Party Hats, Lum-Bear-Jack"
1675,Rec-Tek Over the Door Skeet Hunt Game for Kids - Features Easy Assembly and Easily Adjustable Height - No Tools Required
1676,Funko Pop! Disney: Lion King Live Action - Simba
1677,"Webster's Pages CM5131 Variety Cameo Accent, Party Time, 5-Pack"
1678,NCAA West Virginia Mountaineers Toy Puzzle Cube
1679,TeeTurtle Reversible Llama Mini - Black/Gray Plush Toys
1680,"Nino Percussion NINO-NS355 14-Inch Cymbal with Holding Straps, Nickel Silver"
1681,Redcat Racing 16T/.6 Module Brass Pinion Gear
1682,Poolmaster Smash 'n' Splash Water Paddle Ball Swimming Pool Game
1683,"NCAA Diztracto Fidget Spinnerz - 3 Way, Virginia Tech Hokies, One Size"
1684,"MasterPieces The Right Fit Kids Jigsaw Puzzle, 101 Things to Spot in the Woods, Tillywig Top Fun Award, 101 Piece, For Age 6+"
1685,Bachmann Industries Ringling Bros. and Barnum & Bailey 40' Box Car 33 Tiger O Scale Train
1686,Disney Frozen Elsa Fashion Doll Inspired by Frozen 2
1687,"Melissa & Doug 52 Wooden Alphabet Magnets in a Box (Developmental Toys, Sturdy Wooden Construction, 52 Pieces, Great Gift for Girls and Boys - Best for 3, 4, 5, and 6 Year Olds)"
1688,"Education Outdoors Fawn Pet Pod, One Color, One Size"
1689,Disney Tangled Princess Rapunzel Figure Soft Touch PVC Key Ring Key Accessory
1690,Licenses Products Pink Floyd - Dark Side of the Moon Rubber Keychain
1691,Funko Supercute Plush: Stranger Things Eleven Collectible Plush
1692,"""PAW Patrol Adventures"" Blue Party Favor Plastic Cup 16 Oz."
1693,Funko POP! Star Wars: The Last Jedi - BB-9E - Collectible Figure
1694,Swimline Side by Side Pool Lounger Float
1695,"Sweet Jojo Designs 3-Piece Navy Blue, Aqua and Grey Aztec Mountains Boy or Girl Full/Queen Kid Childrens Teen Bedding Comforter Set"
1696,Funko Pop! Animation: Speed Racer - Speed in Helmet (Styles May Vary)
1697,"Edupress Cause & Effect Game, Red Level (EP60602), Package may vary"
1698,Mastercraft Collection NASA Space Shuttle F/S Full Stack Discovery (L) Model Scale:1/100
1699,Journey Girls Pet Grooming Playset (Amazon Exclusive)
1700,"BuitenSpeel Toys GA194 Buddies Wooden Balancing and Stacking Game, Blue/Green/Purple"
1701,Step2 Corvette Kids Room and Toy Organizer
1702,Conan The Brigand
1703,"Mudpuppy 15 Easy-to-Learn Tricks Magic Set, Ages 6 & Up"
1704,"Melissa & Doug Wooden Construction Building Set in a Box (Developmental Toy, 48 Pieces, Great Gift for Girls and Boys - Best for 4, 5 and 6 Year Olds)"
1705,"Melissa & Doug Let's Play House Fridge Fillers (Pretend Play Grocery Toys, 20 Pieces, Great Gift for Girls and Boys - Best for 3, 4, 5, and 6 Year Olds)"
1706,"Childrens Factory Learning Carpet, Colorful"
1707,TAMASHII NATIONS Bandai S.H.Figuarts Rashid Street Fighter V Action Figure
