1000,"DB Longboards CoreFlex Crossbow 41"" Bamboo Fiberglass Longboard Complete"
1001,"Electronic Snap Circuits Mini Kits Classpack, FM Radio, Motion Detector, Music Box (Set of 5)"
1002,"3Doodler Create Flexy 3D Printing Filament Refill Bundle (X5 Pack, Over 1000'. of Extruded Plastics! - Innovate"
1003,Guillow Airplane Design Studio with Travel Case Building Kit
1004,Woodstock- Collage 500 pc Puzzle
1005,"Terra by Battat – 4 Dinosaur Toys, Medium – Dinosaurs for Kids & Collectors, Scientifically Accurate & Designed by A Paleo-Artist; Age 3+ (4 Pc)"
1006,"Rubie's Child's Pokemon Deluxe Pikachu Costume, X-Small"
1007,"Hoffmaster 120813 Double-Tipped Triangular Crayon, 88 mm Length, Wrapped (500 Packs of 2)"
1008,"ARTSCAPE Etched Glass 24"" x 36"" Window Film, 24-by-36-Inch"
1009,Pokemon TCG: Sun and Moon Crimson Invasion Elite Trainer Box
1010,"Moonlite, 3-Story Bundle for Boys, Includes 3 Story Reels for Use with Storybook Projector"
1011,DC Cover Girls: Black Canary by Joëlle Jones Statue
1012,"Baby Doll Bedding Chevron Window Valance and Curtain Set, Orange"
1013,"LEGO Minecraft Creeper BigFig and Ocelot Characters 21156 Buildable Toy Minecraft Figure Gift Set for Play and Decoration, New 2020 (184 Pieces)"
1014,C&D Visionary DC Comic Originals Flash Logo Sticker
1015,"The Learning Journey ABC Melody Maker, Primary"
1016,"The Complete Common Core: State Standards Kit, Grade 5"
1017,Flash Furniture 25''W x 45''L Trapezoid Red HP Laminate Activity Table - Height Adjustable Short Legs
1018,Schylling Veterinarian Kit
1019,Yellies! Frizz; Voice-Activated Spider Pet; Ages 5 & Up
1020,Disney HK318329 Sofia The First Sleepover Set
1021,Team Associated 9665 Hinge Pin Brace with Hinge Pins B4/T4
1022,"PLUS PLUS - Construction Building Toy, Open Play Set - 3,600 Pieces with Storage Tub - Basic Color Mix"
1023,"Big Party Pack Orange Peel Plastic Plates | 10.25"" | Pack of 50 | Party Supply"
1024,Peppa Pig Shape Sorter Clock Puzzle (12Piece)
1025,Huffy Kids Bikes 16 & 20 inch with Streamers and BMX Pegs
1026,NKOK Sonic and Sega All Stars Racing Remote Controlled Car - Sonic The Hedgehog
1027,Industro Stainless Steel Hose Clamps
1028,"Oopsy Daisy Birchwood Owl Growth Chart, Pink, 12"" x 42"""
1029,Springbok Puzzles - Christmas Wishes - 400 Piece Jigsaw Puzzle - Large 26.75 Inches by 20.5 Inches Puzzle - Made in USA - Unique Cut Interlocking Pieces - Big Pieces for Kids & Small Pieces for Adults
1030,Franklin Sports Eye Black Stickers for Kids - Customizable Lettering Baseball and Football Eye Black Stickers - White Pencil Included
1031,Costume Sunglasses Clown from IT Sun-Staches Party Favors UV400
1032,"Jay Franco Disney Frozen 2 Forest Spirit Twin/Full Comforter & Sham Set, Mutli"
1033,TAMASHII NATIONS Bandai S.H. Figuarts Captain America & Tamashii Effect Explosion Avengers: Infinity War Action Figure
1034,"Forum Novelties Union Officer Child's Costume, Medium"
1035,"Weiler 14506 Nylox Cup Brush, 6"", 0.40/80SC Crimped Fill, 5/8""-11 UNC Nut"
1036,Disney Mickey Golf Ball Spinner Pewter Key Ring Key Accessory
1037,"Anagram International 3085101 Go Team Megaphone Shop Balloon Pack, 29"""
1038,"Happy Birthday Jointed Letter Banner, Under Construction"
1039,Poopsie Unicorn Crush with Glitter and Slime Surprise (2-Pack)
1040,Funko Pop! Games: Persona 5 - The Joker (Styles May Vary)
1041,Klutz Decorate This Journal Toy
1042,Random Esoteric Creature Generator for Classic Fantasy Rpgs & Their Modern Simulacra
1043,Bachmann Trains Great Northern Gondola
1044,"Disney's Alice in Wonderland, ""The Hatter's Mad"" Woven Tapestry Throw Blanket, 48"" x 60"", Multi Color"
1045,Pacific Play Tent Agility Dog Training Chute
1046,Barbie Babysitters Inc. Popcorn Set
1047,"Losi Ride Height Gauge, LOSA99173"
1048,Melissa & Doug Disney Cinderella Rags to Riches Wooden Magnetic Game With 10 Magnetic Pieces and Wand
1049,VTech Twist and Hug Koala Rattle
1050,"LAMO 5"" Vinyl Figure - Legacy Gamers Dr Disrespect, Red"
1051,"Marvel Avengers Assemble Captain America Costume T-Shirt with Mask, Small"
1052,"Vallejo Game Color Sunblast Yellow Paint, 17ml"
1053,"Mudpuppy Unicorn Magic Activity Coloring Roll, Age 4+, Creative Fun with Coloring, Mazes, Spot The Difference and More, Includes 5 Colored Pencils, Easy to Store Unicorn Paper Roll"
1054,Top Trumps Liverpool FC 18/19 Card Game
1055,Hot Wheels Track Builder Straight Track with Car AND Hot Wheels Race Case Track Set
1056,"Wild Republic Mermaid Toy, Slap Bracelet, Gifts for Kids, Purple, Huggers 12"""
1057,Melissa & Doug Annie Doll & Feeding Set Bundle
1058,"LeapFrog LeapStart Preschool 4-in-1 Activity Book Bundle with ABC, Shapes & Colors, Math, Animals"
1059,Sherlock Holmes - The Challenge of Irene Adler
1060,Great Eastern Entertainment Boys Attack On Titan - Levi Wallet
1061,Domez My Hero Academia 4-Piece Bundle
1062,"Paw Patrol, Mighty Pups Charged Up Chase’s Deluxe Vehicle with Lights and Sounds"
1063,Alex Discover Button Art Activity Set Kids Art and Craft Activity
1064,DC Collectibles DCTV: Black Lightning Resin Statue
1065,Rubie's Adult 2-Tone Costume Wig
1066,Funko Pop! Rides: Mulan - Mulan On Khan
1067,Flaghouse Chrome Bowling Ball Ramp
1068,"Trends International DC Comics Movie-Batman v Superman Wall Poster, 14.725"" x 22.375"", Premium Unframed"
1069,"Aurora World Sweet and Softer Perky Penguin 9.5"" Plush"
1070,Baby Alive Luv 'n Snuggle Baby Doll Blond
1071,Mega Construx Welliewishers Playful Playhouse Buildable Playset
1072,Aurora World Miyoni Poodle Pup Plush
1073,"Squish-Dee-Lish Squishy Jumbo Toy, Squishies - Slow Rising Pup-Corn, Soft Kids Squishy Toys 86715"
1074,"Mon AMI Pink Piglet Ballerina Designer Plush Doll, Exquisite Craftmanship, Premium Quality, Cuddling, Collecting & Playing Toy, Baby or Toddler Gift 18"", Multicolor"
1075,Proline 1013214 Hyrax 2G8 Rock Terrain Truck Tires (2)
1076,RoomMates Curious George Peel and Stick Giant Wall Decal - RMK1082GM
1077,NECA - Teenage Mutant Ninja Turtles (1990 Movie) Prop Replica
1078,Hansa Ostrich Baby Plush
1079,RPM 73162 Axle Carriers Black 1/16 Traxxas Black
1080,Mikasa VSO2000 FIVB Replica Volleyball
1081,The Corps Special Forces Action Figures & Vehicle Deluxe Playset (Packaging & Colors May Vary)
1082,Creativity for Kids Clay Keychains
1083,Herbaceous
1084,"Wild Republic Snake Plush, Snake Stuffed Animal, Plush Toy, Pet Snake, Sherbert, 54"""
1085,"NPW-USA NPW67309 Drinking Buddies Dice Game, 6-Piece Set"
1086,Blade 130 S BNF Basic With Safe
1087,"Madame Alexander 8"" ICY Elegance Light Skin Tone Blue Eyes/Blonde Hair"
1088,NCAA Georgia Bulldogs Toy Puzzle Cube
1089,COBI Historical Collection M3 Grant Tank
1090,"Learning Resources Serve It Up! Play Restaurant, Pretend Restaurant Set, 35 Pieces, Ages 3+"
1091,"Amscan 120175 Banner, 8' x 6 1/2"", Multi Color"
1092,"Melissa & Doug K’s Kids Whose Tail? 8-Page Soft Activity Book, The Original (Great Gift for Girls and Boys - Best for Babies and Toddlers, All Ages)"
1093,"Bachmann Old-Time Box Car - Pennsylvania LINES - N Scale, Prototypical Oxide Red"
1094,Jumbo Foil Star Cutout (gold) Party Accessory (1 count)
1095,Aquarius I Heart Unicorns Playing Cards
1096,"Great Eastern Mega Man X4 9"" Plush"
1097,"Robinson Racing Products Robinson Racing 1710 Hardened 10T Pinion Gear 32P, Brown/A"
1098,Maisto R/C 1:14 Scale Lamborghini Huracan Radio Control Vehicle (Colors May Vary)
1099,Aquarius DC Wonder Woman Retro Playing Cards
1100,"MightySkins Skin Compatible with Parrot Bebop 2 – Slow Sloth | Protective, Durable, and Unique Vinyl Decal wrap Cover | Easy to Apply, Remove, and Change Styles | Made in The USA"
1101,"Martha Stewart Crafts Stencil Tape, 32292"
1102,LEGO Friends Heartlake Surf Shop 41315 Building Kit (186 Pieces)
1103,amscan Thank Yous | Hello Kitty Collection | Party Accessory
1104,"Great Pretenders Fairy Blooms Deluxe Dress with Wings, Green, Medium"
1105,"Thames & Kosmos Chem C2000 (V 2.0) Chemistry Set with 250 Experiments and 128 Page Lab Manual, Student Laboratory Quality Instruments & Chemicals"
1106,"The Doll Maker Precious Moments Dolls, Linda Rick, Lion, Lion of Courage, Wizard of Oz, 7 inch Doll"
1107,Swing-N-Slide Blue Child Seat
1108,Kid O Myland UFO & Alien Light Interactive Learning Toy
1109,"Hasbro Little Pony Rainbow Dash Cuddle Pillow, Large, Blue"
1110,Jay Franco Nickelodeon JoJo Siwa Sweet Life Curtain/Drapes
1111,Play-Doh Poop Troop Set with 12 Cans
1112,Marvel Select: Hulk Unleashed Action Figure
1113,Firefly: The Game - Esmeralda Game Expansion
1114,Gym Dandy Teeter-Totter Home Seesaw Playground Set TT-210
1115,Ultra Pro Gamers Bag - Red
1116,"American Educational Vinyl Clever Catch Elementary Science Insects Ball, 24"" Diameter"
1117,Banpresto 35783 My Hero Academia Enter The Hero Izuku Midoriya Figure
1118,"Delta Children Bistro 2-Piece Chair Set, White with Driftwood"
1119,Nations The Dice Game Unrest Expansion
1120,Educational Insights Nancy B's Science Club Binoculars and Wildlife Activity Journal
1121,"Educational Insights Alphabet Transparent Stamps- Uppercase 5/8"""
1122,Enchantimals Styling Head- Brown Mailer
1123,Spirit Riding Free Small Doll & Horse Set - Abigail & Boomerang
1124,Click N' Play Military Logistics Transport Unit 16 Piece Play Set with Accessories.
1125,HiTec RCD 55013 HS-65HB Mighty Karbonite Feather Servo
1126,"Canal Toys Power Dough Unicorns Interactive Dough (11Piece), Multicolor"
1127,COBI Small Army DW Twin-Turret Tank
1128,Trend Enterprises Division 0-12 All Facts Skill Drill Flash Cards
1129,Hitec RCD 44212 X4 Micro AC/DC 1 Cell LiPo Charger
1130,"Craft-tastic – Kindness Kit – Craft Kit Includes 8 Projects to Inspire Kindness, Bilingual"
1131,"Corolle Bebe Bath Oceane - 12"""
1132,"MasterPieces John Wayne Jigsaw Puzzle, America's Cowboy, Legendary Collection, 1000 Pieces"
1133,"Perler 80-22860 Instruction Pad for Fuse Beads, 86 Patterns, Summertime Fun Piece"
1134,Tiny Arcade Pole Position
1135,WWE Rey Mysterio Elite Collection Action Figure
1136,Dragon Ball Fighterz - PlayStation 4
1137,Original 3D Crystal Puzzle - Swan
1138,"Dark Horse Deluxe The Umbrella Academy Playing Cards, Multicolor"
1139,"Strawberry Shortcake Classic Doll, 6"""
1140,"Darice Doll Hat: Black Felt Top Hat, 2 inches, 1 Piece"
1141,"Sugarbooger Silicone Teether Set-of-Two, Happy Cactus"
1142,"Wild Republic Horse Plush, Stuffed Animal, Plush Toy, Gifts for Kids, Cuddlekins, Brown 12 Inches"
1143,LEGO Technic Power Functions Motor Set 8293 (10 Pieces)
1144,"WalthersTrainline Ready to Run Union Pacific #908814 Firefighting Car, Green/Black"
1145,Punto Tin -The Pt.-to Pt. Card Game
1146,"SpongeBob SquarePants, Masterpiece Memes, 8” Collectible Vinyl Figure, Handsome Squidward (Closed Eyes)"
1147,Melissa & Doug Bella Butterfly Net
1148,Pokemon 3 Inch Alolan Muk Articulated Battle Action Figure
1149,"Jada Limited Edition 4"" METALFIGS - Power Rangers - RED Ranger M334 99270"
1150,Medieval Princess Fuschia Child Costume
1151,Vallejo Imperial Rome Era Paint Set
1152,Indie Boards and Cards Flash Point Fire Rescue 2nd Story
1153,Dremel 7103 5/64-Inch Diamond Wheel Point
1154,"American Greetings My Little Pony Swirl Decorations, 12-Count, Multicolored - AMI 675513"
1155,Lightseekers Trading Card Game Intro Pack
1156,"Amscan Party Supplies, Multicolor"
1157,Nuts
1158,Carson Dellosa Key Education Verbs: Actions Learning Cards (845005)
1159,theory11 Product(RED) Playing Cards
1160,Disney Pixar Cars Trainer Cruz Ramirez
1161,Mudpuppy Bonjour Paris! Magnetic Figures
1162,"Fashion Angels We Smell Sweet Bracelet Kit, Assorted"
1163,"Mayflower Distributing Company 55270 U OF VIRGINIA - BEV NAPKIN 24CT, One size, Multicolor"
1164,Forum Novelties Men's Adult Suede Cowboy Hat
1165,DC Collectibles DC Artists Alley: Wonder Woman by Chris Uminga Limited Edition Vinyl PVC Figure
1166,Transformers Bumblebee Movie Muscle Bumblebee Costume for Infants
1167,Carrera 23856 Ferrari 512 S Berlinetta Scuderia Filipinetti #3 1970 Digital 124 Slot Car 1:24 Scale
1168,"Nick Jr. Dora the Explorer Child's Dora Costume with Backpack, Small"
1169,"Amscan 399918 6 Piece Game Day Photo Props Kit, One Size, Multicolor"
1170,"Forum Novelties Men's Standard Adult All Wrapped Up Ugly Christmas Sweater, Naughty Stocking, Large"
1171,"Sport Squad HX40 40 inch Table Top Air Hockey Table for Kids and Adults - Electric Motor Fan - Includes 2 Pushers and 2 Air Hockey Pucks - Great for Playing on The Floor, Tabletop, or Dorm Room"
1172,BeginAgain BuddyBlocks Safari Animals - Matching and Problem Solving - Kids 18 Months and Up
1173,Snow White and The Huntsman Deluxe Queen Ravenna Costume
1174,"Skip Hop Bandana Buddies Baby Activity and Teething Toy with Multi-Sensory Rattle and Textures, Elephant"
1175,"American Educational Inflatable World Globe, 24"""
1176,Gowi Toys Austria Police Van with Police Play Figures
1177,Bendon Finding Dory Sticker Box
1178,Playmobil My Café
1179,4M Glow-In-The-Dark 3D Dinosaur
1180,Battat – 3 Car Garage – Shape Sorting Toy Garage with Keys and 3 Toy Cars for Toddlers 2 years + (5-Pcs)
1181,RoomMates My Little Pony Fluttershy Peel and Stick Giant Wall Decals
1182,Funko Pop! Marvel: Avengers Endgame - Iron Spider with Nano Gauntlet
1183,"Transformers Toys Cyberverse Action Attackers: 1-Step Changer Skybyte Action Figure - Repeatable Driller Drive Action Attack - for Kids Ages 6 & Up, 4.25"""
1184,"amscan Pretty Potion Witch Halloween Costume for Girls, with Included Accessories"
1185,"Eureka Back to School Gold Glitter Star Stickers for Kids and Teachers, 72pc"
1186,Faber-Castell Creative Studio Goldfaber Aqua Watercolor Pencils - Tin of 12 Colors
1187,Medicom Neon Genesis Evangelion: Eva Evangelion Unit 01 Shogo-Ki Maf Ex Action Figure
1188,"Lionel FasTrack Electric O Gauge, O36 Curve Track, 4-Pack"
1189,Rubies Devil Girls Child Red Demon Costume
1190,"Bright Starts Rattle & Shake Barbell Toy, Ages 3 months +"
1191,Pete The Cat Groovy Buttons Mini Stickers
1192,"Disney Rapunzel Acrylic Key Ring, Multicolor"
1193,"Fisher-Price #Selfie Fun Phone, Baby Rattle, Mirror and Teething Toy"
1194,Rubie's Costume Womens Police Costume
1195,"LEGO Creator Expert Gingerbread House 10267 Building Kit, New 2020 (1,477 Pieces)"
1196,Folkmanis Standing Bear Hand Puppet
1197,Pro Series CLM-16 Red Plastic Scoring Pills for Kelly Pool in Hang Pack
1198,Awesome Paw Patrol Bundle of 3 Pieces
1199,Rubie's Suicide Squad Joker Teeth Adult Costume
1200,"Papo Wild Animal Kingdom Figure, Cheetah with Cub"
1201,"3DLightFX Nickelodeon Tent, Leonardo's Katana"
1202,"DC Lantern 2.75"" PVC Figure, Green"
1203,"Nickelodeon's Dora and the Lost City of Gold Nickelodeon's Dora & The Lost City of Gold: Boots, Multicolor"
1204,"Star Wars: The Force Awakens Child's Stormtrooper Costume, Medium"
1205,Ceaco Perfect Piece Count Puzzle - Thomas Kinkade Disney Dreams Collection - Beauty and the Beast
1206,Disney Belle Soft Touch PVC Key Ring
1207,"Forum Novelties Prince Charming Child's Costume, Small"
1208,Rubie's Costume Dc Heroes and Villains Collection Joker Latex Mask
1209,"VTech Click and Count Remote, Black"
1210,Daron United 747 Single Plane
1211,"FOCO DC Comics Justice League Character Bobble, Superman"
1212,"amscan Frozen 2 Birthday, Metallic Blowouts, Party Favor, 7.25"", 8 Ct."
1213,"BePuzzled Original 3D Crystal Jigsaw Puzzle - Wolf Animal Assembly Brain Teaser, Fun Model Toy Gift Decoration for Adults & Kids Age 12 and Up, Black, 37 Pieces (Level 1)"
1214,TOMY John Deere Learn 'n Pop Farmyard Friends Toy
1215,Forum Novelties Jolly Elf Adult Costume
1216,Melissa & Doug Disney Sofia the First and Princess Amber Magnetic Dress-Up Wooden Doll Pretend Play Set (40+ pcs)
1217,"Melissa & Doug Created By Me! Heart Beads Wooden Bead Set - The Original (Jewelry-Making Kit, Over 120 Beads, 5 Cords, Great Gift for Girls and Boys – Best for 4, 5, 6, 7 and 8 Year Olds)"
1218,Eureka Educational Blue Harmony Assorted Diamonds (841357)
1219,"Wild Republic Great White Shark Plush Stuffed Animal Toy, Gifts for Kids, Cuddlekins 20 Inches"
1220,Privateer Press Warmachine - Convergence of Cyriss - Accretion Servitors Model Kit
1221,Entertainment Earth Designer Series Wonder Woman by Darwyn Cooke Action Figure
1222,Entertainment Earth Batman Black & White 1st Appearance by Bob Kane Figure
1223,"Stephen Joseph Cape, Unicorn"
1224,Yu-Gi-Oh! Cards: Cyberse Link Structure Deck
1225,"Huffy Disney Princess Kid Bike 12 inch & 16 inch, Quick Connect Assembly & Regular Assembly, Pink"
1226,"Wild Republic Cuddlekin Three Toed Sloth 12"" Plush"
1227,In the Breeze Silver Sparkle Tails
1228,X-Shot Chaos Orbit Dart Ball Blaster (100 Rounds) - Double Blaster Pack by Zuru
1229,Transformers TCG: Bumblebee Vs. Megatron 2-Player Starter Set | 1 Ready-to-Play Deck | 44 Cards Incl. Bumblebee
1230,"EVAN-MOOR 4545 Skill Sharpeners Math Book, Grade 1, 0.5"" Height, 8.5"" Width, 11"" Length"
1231,"Mrs. Grossman's Outer Space Reusable Sticker Activity Set, Multicolor"
1232,Bachmann Trains Norfolk and Western Flat Car
1233,Bigjigs Rail Wooden Fairy Town Train Set - 75 Play Pieces
1234,"Lionel Racing, Chase Elliott, Napa Nightvision, 2018, Chevrolet Camaro, NASCAR Diecast 1: 24 Scale"
1235,Calplush Safari Friends Black Panther Plush Animal Toy
1236,Magic Cabin 25-Piece Carpenter's Essentials Set
1237,Backyard Discovery Woodland All Cedar Wood Playset Swing Set
1238,"Safety 1st Rubber TempGuard, Ducky"
1239,"Horizon Group USA Painting Panel Canvas Boards, 9x12, Pack of 12"
1240,Happy Trails Zebra Plush Rocking Animal
1241,"Wild Republic T-Rex Plush, Dinosaur Stuffed Animal, Plush Toy, Gifts for Kids, Dinosauria 17 Inches"
1242,"Du-Bro 223 1/8"" x 2' Large Super Blue Silicone Tubing"
1243,"Galison Joy to The World 1000 Piece Jigsaw Puzzle for Adults, Holiday Puzzle for Families with Festive Theme"
1244,"Marvel: Animated Spider-Man Movie Mile Morales Spider-Man Collectible Figure, Multicolor"
1245,"Tamiya TAM58646 1/18 R/C Konghead 6x6 (G6-01) Kit, Brown"
1246,"Schleich North America Tyrannosaurus Rex Toy Figure, Red"
1247,Bachmann EMD 70ACe DCC Sound Value Equipped Diesel Locomotive - ILLINOIS TERMINAL #1072 (with operating ditch lights) - HO Scale
1248,"edx Education School Friendly Playing Cards - Jumbo Size - Set of 56 - Multicolored Patterned Cards Numbered 0-13 for Gameplay - Teach Number Concepts, Counting, Matching and Probability"
1249,"Colorbok YPI50047 You Paint It Plaster Kit, Value Pack, Enchanted"
1250,Funko Pop! Keychain: Frozen 2 - Elsa
1251,Rayne Longboards Demonseed Longboard Complete
1252,"K2 Skate Men's Kinetic 80 Pro Inline Skate, Black White, 10.5"
1253,Center Enterprise CE6620 Circular Washable Vivid Orange Stamp Pad
1254,Funko Pop Games: Fortnite - Tomatohead
1255,K’NEX – Turbo Jet – 2-in-1 Building Set – 402 Pieces – Ages 7+ – Engineering Educational Toy
1256,Kettler Advantage Indoor Table Tennis Bundle: 4 Player Set (4 Rackets/Paddles and 8 Balls)
1257,"Ravensburger Disney Princess Adorable Cinderella 100 Piece Glitter Jigsaw Puzzle for Kids – Every Piece is Unique, Pieces Fit Together Perfectly"
1258,Folkmanis Mini Sitting Frog
1259,"Funko Pop Marvel: Runaways - Molly Collectible Figure, Multicolor"
1260,"Delta Children Plastic Toddler Bed, Nickelodeon SpongeBob SquarePants"
1261,Yoshi's Crafted World - Nintendo Switch
1262,"Avengers Marvel Black Panther 6""-Scale Marvel Super Hero Action Figure Toy"
1263,Swagtron Swagger 2 Plus Foldable Electric Scooter for Adults & Teens
1264,"VTech Baby Lil' Critters Shake and Wobble Busy Ball Amazon Exclusive, Purple"
1265,Wildkin Kids 17 Inch Backpack
1266,Barbie Dolphin Magic Snorkel Fun Friends
1267,Melissa & Doug Pretend Play Wooden Star Diner Restaurant With 40+ Accessories and Play Food
1268,Mudpuppy Princesses Color in Crowns
1269,WWE Rowan Elite Collection Action Figure
1270,DIAMOND SELECT TOYS John Wick Vinimate
1271,"Wild Republic Mountain Goat Plush, Stuffed Animal, Plush Toy, Gifts for Kids, Cuddlekins 8 Inches"
1272,Pokemon TCG: Mega Camerupt EX Premium Collection Box
1273,Sun-Staches Costume Sunglasses Incredibles Edna Mode Glasses Party Favors UV400
1274,AMERICAN GREETINGS Bright Colors Latex Balloons | Pack of 15 | Party Decor
1275,GreenBrier Games Yashima Legends from Fairytale Board Game
1276,Bachmann Industries New Haven 50' Plug Door Box Car
1277,"HARRY POTTER Collapsible Storage Cubes 2 Pack, Red"
1278,"Animal Adventure | Popovers Travel Pillow | Orange Fox | Transforms from Character to Travel Pillow | 13"" x 8.5"" x 6"
1279,Plush Royal Crown (purple) Party Accessory (1 count) (1/Pkg)
1280,Wind-Up Walking Families - Duck Family
1281,"Melissa & Doug Kids Furniture, Wooden Table & 4 Chairs (White Table, Pastel Pink, Yellow, Green, Blue Chairs, 20.5” H x 23.5” W x 20” L, Great Girls and Boys – Best for 3, 4, 5, 6, 7 and 8 Year Olds)"
1282,Bohnanza: High Bohn Plus Bohnaparte Card Game
1283,Hey! Play! Kids Pop-up Six-sided Ball Pit Tent
1284,Bandai Hobby MG 1/100 Gunner Zaku Warrior (Lunamaria Hawke Custom) Gundam Seed Destiny
1285,DIAMOND SELECT TOYS Batman The Animated Series: Ra's Al Ghul Resin Bust Figure
1286,Skywalker Trampolines 9x15 Blue Rectangle Spring Pad
1287,"Sticko 450188 Stickers, Shimmery Stars"
1288,"Step2 2-in-1 Toy Box & Art Lid | Plastic Toy & Art Storage Container, Grey"
1289,"9"" SOCCER BALL INFLATE"
1290,Wood Photo Knobbed Puzzles for Kids
1291,PRINZ Man Money Curse Fund Piggy Bank
1292,"Adora ToddlerTime Girl Doll, Macaraccoon, Weighted Vinyl Baby Doll Toy with Soft Body, 20-inch (Ages 6+)"
1293,"Ergobaby Metro Compact City Stroller Accessories, Backpack-Style Carry Bag"
1294,"LIL TOTS Princess 14"" Doll & Unicorn Set"
1295,"Discovery Layers of The Earth Geology Sand Dig Kit by Horizon Group USA, 3-in-1 Earth Exploration"
1296,"Gorilla Playsets 01-3036-G Malibu Playhouse Wooden Playhouse for Kids, Brown & Green"
1297,"GUND Baby My First Christmas Reindeer Lovey Plush Blanket, 12"", Brown"
1298,Power Rangers 97376 Blaster Role Play
1299,"Celebrity 24DCL 24"" Latex Balloons, Clear (Pack of 10)"
1300,Emoji Pals Kissy Kids Saucer Chair
1301,"Creativity for Kids My First Fun Felt Shapes - Travel Friendly Felt Board for Toddlers (Imaginative Pretend Play for Kids, 100+Piece)"
1302,"Melissa & Doug Mine to Love Jordan 12” Baby Doll (Includes Romper, Cap, Pacifier, Great Gift for Girls and Boys - Best for Babies, 18 Month Olds, 24 Month Olds, 1 and 2 Year Olds )"
1303,Darice 9163-46 Wood Airplane Craft
1304,"University Games Break Out Game, Kids"
1305,"Anna Frozen Fever Deluxe Costume, One Color, 3T-4T"
1306,Crawl N Play
1307,Bicycle Rider Back Playing Cards
1308,"Gigantosaurus Figures Giganto & Friends Toy Action Figures, Includes: Giganto, Mazu, Bill, Tiny & Rocky – Articulated Characters Range from 2.5-5.5"" Tall"
1309,Greenlight 1:64 Hobby Exclusive - 1967-72 Ford F-350 Ramp Truck with Truck Driver Figure Diecast Toy Car 29892
1310,"Top Notch Teacher Products Chart Tablet Polka Dot (1 1/2"" Ruled), Red, 24"" x 32"""
1311,Schylling Shuffle Shot
1312,"NKOK Ghostbusters Animated B/O Ecto1 with Slimer B/O 1, Ghost Catcher"
1313,"Melissa & Doug Magnetivity Magnetic Tiles Building Play Set – School with School Bus Vehicle (106 Pieces, STEM Toy, Great Gift for Girls and Boys - Best for 4, 5, 6, 7, 8 Year Olds and Up)"
1314,"Barbie Bride Costume, Medium"
1315,My Own Pet Balloons Cat Domestic Animal
1316,Turtle Beach XO Three Gaming Headset for Xbox One
1317,"Melissa & Doug Children’s Book - Float-Alongs: Tiny Tugboats (Bath Book + 3 Floating Tugboat Toys, Great Gift for Girls and Boys - Best for Babies and Toddlers, 4, 5, 9 Month Olds, 1 and 2 Year Olds)"
1318,Fisher-Price Slow Much Fun Stroller Sloth
1319,"Pitsco TETRIX Gear Pack (40, 80, and 120-tooth)"
1320,"Click N' Play Jumbo 10.5”"" Animal Figurine Playset, Assorted 5Piece Realistically Designed Wild Zoo, Safari, Jungle Plastic Animals for Kids & Toddlers"
1321,Silver Unicorn
1322,"Triple Eight Sweatsaver Liner Skateboarding Helmet, Zest Rubber, Small"
1323,"Rollerblade Twister Edge Men's Adult Fitness Inline Skate, Black and Red, High Performance Inline Skates"
1324,Click N’ Play Military Police Elite SWAT Patrol Team 32 Piece Play Set with Accessories
1325,Crate Creatures Surprise- Blizz
1326,EMD GP40 Diesel Locomotive UNION PACIFIC #508 (without dynamic brakes) - N Scale
1327,"Redcat Racing GA-5500-100C-5MMBullet Gens Ace 5500mAh 7.6V 100C 2S2P Hardcase Hv Lipo Battery Pack 59# Racing Series, Black"
1328,Airfix Gloster Gladiator MK I/MK II 1:72 WWII Military Aviation Plastic Model Kit A02052A
1329,Gamma Shockbuster Vibration Dampener
1330,Juniors Go Go Girl Black Costume (Standard;Child Large)
1331,Forum Novelties Child's Tutu Skirt
1332,Fun2Give Pop-It-Up Dollhouse Tent with House Playmat Playhouse
1333,Osmo - Super Studio Disney Mickey Mouse & Friends Game - Ages 5-11 - Learn to Draw your Clubhouse Favorites & Watch them Come to Life - For iPad and Fire Tablet (Osmo Base Required)
1334,Dark Horse Deluxe Geralt Playing Gwent Bust Toy
1335,Faber-Castell Grip Watercolor EcoPencils - 12 Water Color Pencils with Brush
1336,BigWood Boards Lucky Bums Snowball Snowbrick Maker Set
1337,Busch 4131 Lamp on Lattice Mast Oval HO Scale Model Lighting
1338,Disney Princess Dancing Doodles Belle
1339,"Bedtime Originals Plush Toy, Dog Whiskers"
1340,"Pacific Play Tents 20305 Izzy The Friendly Monster Sleeping Bag - 58"" x 28"""
1341,Melissa & Doug Lovey Lamb Stuffed Animal (10 inches)
1342,"All About Details CATHE60 Hello 60 Cake, 1pc, 60th Birthday, Party Decor, Glitter Topper (Gold & Black), 6 x 9,"
1343,"Hampton Nautical Wooden Charles W. Morgan Model Whaling Boat, 15"""
1344,In the Breeze Dragon Twister
1345,Drama Queens: Bad Spirit Kids Costume Small 4-6
1346,Fisher-Price Little People Dump Truck
